run_id,config,topic,type,seed,source_text_sha,idx,qid_gold,qid_pred,structural_valid,question_sim,ans_sim,distractor_diversity,ans_score,item_score,judge_verdict,judge_score,judge_why,judge2_verdict,judge2_score,judge2_why
race50_mcq_hehe1,cot,Preposition + V-ing,mcq,0,dc98844b58dc8053cb6b0963852df8971533fae3793d5393d72653f51fa28d7d,1,eng-vn-prep-ving-01,pv_001,1,0.5093,,0.195,,0.415,correct,1.0,"Stem yêu cầu một cấu trúc diễn tả sự quan tâm, theo sau là một danh động từ (""joining""). Chỉ có ""interested in"" (a) tạo thành cấu trúc đúng ngữ pháp và ngữ nghĩa ""be interested in doing something"". Các phương án khác sai dạng tính từ (""interesting"") hoặc sai giới từ đi kèm.",correct,1.0,"Stem yêu cầu tính từ chỉ sự quan tâm và giới từ phù hợp với 'joining'. Option a 'interested in' là cấu trúc đúng với tính từ 'interested' đi với giới từ 'in' và theo sau là V-ing, trong khi các option khác sai cấu trúc ngữ pháp."
race50_mcq_hehe1,cot,Preposition + V-ing,mcq,0,dc98844b58dc8053cb6b0963852df8971533fae3793d5393d72653f51fa28d7d,2,eng-vn-prep-ving-02,pv_002,1,0.5807,,0.1959,,0.4653,correct,1.0,"Stem yêu cầu một giới từ đi sau tính từ 'good' để diễn tả năng lực hoặc kỹ năng. Cấu trúc cố định 'good at + V-ing' là chính xác về mặt ngữ pháp và ngữ nghĩa trong trường hợp này, khiến phương án (a) là lựa chọn đúng duy nhất.",correct,1.0,"Stem yêu cầu cụm từ với 'good' + giới từ + V-ing để diễn tả năng lực. 'Good at showing' là cấu trúc chuẩn (good at + V-ing), các option khác ('in', 'to', 'for') không phù hợp với 'good' trong ngữ cảnh này."
race50_mcq_hehe1,cot,Preposition + V-ing,mcq,0,dc98844b58dc8053cb6b0963852df8971533fae3793d5393d72653f51fa28d7d,3,eng-vn-prep-ving-03,pv_003,1,0.4384,,0.2308,,0.3761,correct,1.0,"Stem yêu cầu một giới từ để hoàn thành cấu trúc 'Instead...'. Cụm giới từ cố định và đúng ngữ pháp để chỉ sự thay thế là 'Instead of' + V-ing, do đó phương án (a) là lựa chọn duy nhất phù hợp.",correct,1.0,Stem có cấu trúc 'Instead _____ playing' yêu cầu giới từ đi với 'instead' là 'of' (instead of + V-ing). Chỉ option a 'of playing' đúng ngữ pháp; các option còn lại dùng giới từ không phù hợp với 'instead'.
race50_mcq_hehe1,cot,Preposition + V-ing,mcq,0,dc98844b58dc8053cb6b0963852df8971533fae3793d5393d72653f51fa28d7d,4,eng-vn-prep-ving-04,pv_004,1,0.4,,0.227,,0.3481,correct,1.0,"Động từ 'thank' yêu cầu giới từ 'for' để diễn tả lý do hoặc nguyên nhân của hành động. Cấu trúc cố định là 'thank someone for something/doing something', do đó 'for painting' là lựa chọn duy nhất đúng về ngữ pháp.",correct,1.0,"Stem yêu cầu giới từ theo sau 'thanked' + tân ngữ, chỉ mục đích/lý do. 'For painting' là cấu trúc chuẩn (thank someone for doing something). Các option khác ('to paint', 'of painting', 'about painting') không phù hợp với động từ 'thanked' trong ngữ cảnh này."
race50_mcq_hehe1,cot,Preposition + V-ing,mcq,0,dc98844b58dc8053cb6b0963852df8971533fae3793d5393d72653f51fa28d7d,5,eng-vn-prep-ving-05,pv_005,1,0.4924,,0.1959,,0.4034,correct,1.0,Cụm động từ 'look forward to' yêu cầu một danh động từ (V-ing) theo sau. Phương án (a) 'to showing' là lựa chọn duy nhất tuân thủ đúng cấu trúc ngữ pháp này.,correct,1.0,"Stem có cụm 'look forward' yêu cầu giới từ 'to' và động từ theo sau ở dạng V-ing, do đó chỉ có option a 'to showing' là phù hợp rõ ràng; các option khác sai giới từ hoặc dạng động từ."
race50_mcq_hehe1,minimal,Future (going to),mcq,0,2dcc47fa10a58385afea7224fae3f875c3c7d440702a7c64ae116d19b5e74f9f,1,future-going-to-mcq-01,q1,1,0.2479,,0.4374,,0.3047,ambiguous,0.5,"Stem là một câu hỏi đọc hiểu, yêu cầu thông tin dựa trên ý kiến của một người (""According to Mike Shatzkin""), nhưng không cung cấp đoạn văn bản tham chiếu. Do đó, không có cơ sở để xác định lựa chọn nào là chính xác.",ambiguous,0.5,"Stem không cung cấp thông tin cụ thể về quan điểm của Mike Shatzkin, khiến không thể xác định rõ ràng option nào phù hợp dựa trên ngữ cảnh đã cho; các option a, c, d đều có khả năng hợp lý nhưng thiếu bằng chứng để loại trừ."
race50_mcq_hehe1,minimal,Future (going to),mcq,0,2dcc47fa10a58385afea7224fae3f875c3c7d440702a7c64ae116d19b5e74f9f,2,future-going-to-mcq-02,q2,1,0.2663,,0.3185,,0.2819,correct,1.0,"Stem yêu cầu xác định quan điểm về sự ""biến mất hoàn toàn"" của sách. Option (b) trả lời trực tiếp vào trọng tâm này bằng cách phủ định nó (""not going to disappear entirely""). Các option khác đưa ra các khả năng riêng biệt (biến mất sớm, bị thay thế, hoặc thay đổi công dụng) và không gây mơ hồ hay trùng lặp với đáp án đúng.",ambiguous,0.5,"Stem không cung cấp ngữ cảnh hay ràng buộc nào về quan điểm của Robert Stein, nên không thể xác định option nào phù hợp rõ ràng dựa chỉ trên stem và options."
race50_mcq_hehe1,minimal,Future (going to),mcq,0,2dcc47fa10a58385afea7224fae3f875c3c7d440702a7c64ae116d19b5e74f9f,3,future-going-to-mcq-03,q3,1,0.2205,,0.4981,,0.3037,ambiguous,0.5,"Câu hỏi yêu cầu thông tin dựa trên quan điểm của một người tên là Robert Stein (""According to Robert Stein""), nhưng không cung cấp văn bản nguồn. Không có ngữ cảnh này, không thể xác định được lựa chọn nào là đúng.",ambiguous,0.5,"Stem chỉ yêu cầu dự đoán về vai trò của 'print' trong tương lai theo Robert Stein, nhưng không cung cấp thông tin nào về quan điểm của ông để đánh giá tính phù hợp của các lựa chọn, khiến không thể xác định option nào là chính xác dựa trên stem."
race50_mcq_hehe1,minimal,Future (going to),mcq,0,2dcc47fa10a58385afea7224fae3f875c3c7d440702a7c64ae116d19b5e74f9f,4,future-going-to-mcq-04,q4,1,0.1886,,0.4512,,0.2674,ambiguous,0.5,"Stem yêu cầu xác định điều mà Maryanne Wolf ""lo lắng"", tức một hệ quả tiêu cực. Cả hai phương án (b) ""tạo ra một 'bộ não đọc bị đoản mạch'"" và (d) ""thay thế tất cả sách in"" đều mô tả những lo ngại hợp lệ. Stem không cung cấp đủ thông tin để phân biệt đâu là mối lo ngại cụ thể của nhân vật này, khiến không thể chọn một đáp án duy nhất.",correct,1.0,"Stem hỏi về mối lo ngại của Maryanne Wolf, và option b mô tả một hậu quả tiêu cực ('short-circuited reading brain') phù hợp với ngữ cảnh lo lắng, trong khi các option khác (a, c) tích cực hoặc (d) cực đoan không khớp với ý 'lo ngại'."
race50_mcq_hehe1,minimal,Future (going to),mcq,0,2dcc47fa10a58385afea7224fae3f875c3c7d440702a7c64ae116d19b5e74f9f,5,future-going-to-mcq-05,q5,1,0.2686,,0.2055,,0.2497,ambiguous,0.5,"Câu hỏi yêu cầu xác định hy vọng của một người cụ thể (Maryanne Wolf), nhưng phần stem không cung cấp bất kỳ thông tin hay ngữ cảnh nào về quan điểm của người này. Do đó, không thể xác định được đáp án chính xác chỉ dựa vào câu hỏi.",correct,1.0,"Stem yêu cầu xác định loại hình xã hội Maryanne Wolf hy vọng duy trì, với 'bi-literate' trong option c phù hợp rõ ràng, trong khi các option a, b, d bị loại do mâu thuẫn với khái niệm này."
race50_mcq_hehe1,cot,Future (going to),mcq,0,2dcc47fa10a58385afea7224fae3f875c3c7d440702a7c64ae116d19b5e74f9f,1,future-going-to-mcq-01,future_goingto_001,1,0.4502,,0.1856,,0.3708,ambiguous,0.5,"Chủ ngữ 'printed books' là số nhiều và trạng ngữ 'in 10 years from now' chỉ tương lai. Cả hai phương án 'are going to be' (a) và 'will be' (b) đều phù hợp về ngữ pháp và ngữ nghĩa để diễn tả một dự đoán, và câu không cung cấp đủ ngữ cảnh để phân biệt giữa chúng.",incorrect,0.0,"Stem có 'in 10 years from now' chỉ tương lai xa, nên option d (were going to be) bị loại do thì quá khứ. Tuy nhiên, cả a (are going to be) và b (will be) đều phù hợp ngữ pháp và nghĩa cho dự đoán tương lai, không có ràng buộc nào trong stem phân biệt được 'going to' vs 'will'. Option c (is going to be) sai vì chủ ngữ số nhiều 'books'."
race50_mcq_hehe1,cot,Future (going to),mcq,0,2dcc47fa10a58385afea7224fae3f875c3c7d440702a7c64ae116d19b5e74f9f,2,future-going-to-mcq-02,future_goingto_002,1,0.4338,,0.248,,0.378,ambiguous,0.5,"Stem yêu cầu một động từ ở thì tương lai, số nhiều để phù hợp với chủ ngữ ""books"". Cả hai phương án (a) ""aren't going to"" và (b) ""won't"" đều đúng ngữ pháp và phù hợp về nghĩa để diễn đạt một dự đoán, do đó không có cơ sở rõ ràng để chọn một đáp án duy nhất.",incorrect,0.0,"Stem thể hiện niềm tin về tương lai với 'believes' và 'at least not anytime soon', cả option A và B đều phù hợp ngữ pháp và ngữ nghĩa mà không có đủ bằng chứng để phân biệt rõ ràng."
race50_mcq_hehe1,cot,Future (going to),mcq,0,2dcc47fa10a58385afea7224fae3f875c3c7d440702a7c64ae116d19b5e74f9f,3,future-going-to-mcq-03,future_goingto_003,1,0.3317,,0.2331,,0.3022,ambiguous,0.5,"Câu điều kiện loại 1 yêu cầu một thì tương lai trong mệnh đề chính. Cả hai phương án 'are going to have' (a) và 'will have' (b) đều đúng ngữ pháp và phù hợp về nghĩa để diễn tả một dự đoán, và câu gốc không cung cấp đủ ngữ cảnh để loại trừ một trong hai.",ambiguous,0.5,Stem không cung cấp đủ ngữ cảnh thời gian hoặc dấu hiệu ngữ pháp rõ ràng để phân biệt giữa 'are going to have' (a) và 'will have' (b); cả hai đều có thể chấp nhận được để diễn đạt lo ngại về tương lai.
race50_mcq_hehe1,cot,Future (going to),mcq,0,2dcc47fa10a58385afea7224fae3f875c3c7d440702a7c64ae116d19b5e74f9f,4,future-going-to-mcq-04,future_goingto_004,1,0.3913,,0.1856,,0.3296,ambiguous,0.5,"Stem yêu cầu một động từ tương lai bị động, số nhiều để phù hợp với chủ ngữ ""future forms of books"". Cả hai phương án ""are going to be"" (a) và ""will be"" (b) đều đáp ứng các yêu cầu này để diễn tả một dự đoán. Stem không cung cấp đủ ngữ cảnh để phân biệt rõ ràng giữa hai lựa chọn này.",incorrect,0.0,"Stem có 'imagines' (tưởng tượng ở hiện tại) về tương lai, nên cả 'are going to be' (a) và 'will be' (b) đều phù hợp ngang nhau mà không có tín hiệu ngữ pháp nào trong stem để phân biệt rõ ràng. Option c (is) sai vì chủ ngữ số nhiều 'forms', option d (were) sai vì không phù hợp với thì tương lai."
race50_mcq_hehe1,cot,Future (going to),mcq,0,2dcc47fa10a58385afea7224fae3f875c3c7d440702a7c64ae116d19b5e74f9f,5,future-going-to-mcq-05,future_goingto_005,1,0.4545,,0.3138,,0.4123,correct,1.0,"Stem yêu cầu một cấu trúc tương lai phù hợp với chủ ngữ số nhiều ""we"". Cấu trúc ""be going to + infinitive"" (sẽ làm gì) để diễn tả dự định là phù hợp nhất với động từ ""hopes"". Option (a) ""are going"" tạo thành cụm ""we are going to maintain"" đúng ngữ pháp và ngữ nghĩa. Các option khác sai về sự hòa hợp chủ-vị hoặc thì.",incorrect,0.0,"Stem có 'hopes that' chỉ mong muốn tương lai, nhưng cả 'are going' (a) và 'will go' (b) đều phù hợp ngữ pháp và nghĩa với chủ ngữ 'we'. Không có tín hiệu nào trong stem để phân biệt rõ ràng giữa 'going to' (kế hoạch) và 'will' (quyết định), nên đáp án gán 'a' là duy nhất đúng là không thuyết phục."
race50_mcq_hehe1,minimal,Past Simple,mcq,0,4944d8acfc6dd5bbcd830a8e627fa520fced7bfe7623fb5782a8711ce0aa43ab,1,eng_past_simple_01,q1,1,0.7073,,0.1752,,0.5477,ambiguous,0.5,"Trạng từ ""recently"" trong câu gốc có thể đi kèm với cả thì Quá khứ đơn (phương án c) và Hiện tại hoàn thành (phương án d). Do không có thêm ngữ cảnh để phân biệt, cả hai phương án đều đúng ngữ pháp và phù hợp, khiến câu hỏi trở nên không rõ ràng.",correct,1.0,"Stem có 'recently' và ngữ cảnh mô tả sự kiện đã xảy ra trong quá khứ, nên thì quá khứ đơn (turned) là phù hợp rõ ràng; các option khác (turn, turns, has turned) không khớp với chủ ngữ 'I' hoặc ngữ cảnh thời gian."
race50_mcq_hehe1,minimal,Past Simple,mcq,0,4944d8acfc6dd5bbcd830a8e627fa520fced7bfe7623fb5782a8711ce0aa43ab,2,eng_past_simple_02,q2,1,0.5867,,0.1803,,0.4648,correct,1.0,"Trạng từ chỉ thời gian ""A few days ago"" trong câu gốc chỉ một hành động đã hoàn tất tại một thời điểm cụ thể trong quá khứ, do đó yêu cầu sử dụng thì quá khứ đơn. Chỉ có phương án (c) ""tried"" là động từ ở thì quá khứ đơn.",correct,1.0,"Stem có 'a few days ago' chỉ thời gian quá khứ xác định, nên động từ phải chia ở thì quá khứ đơn. Option 'c' (tried) phù hợp rõ ràng, các option khác (try, tries, has tried) không phù hợp với dấu hiệu thời gian này."
race50_mcq_hehe1,minimal,Past Simple,mcq,0,4944d8acfc6dd5bbcd830a8e627fa520fced7bfe7623fb5782a8711ce0aa43ab,3,eng_past_simple_03,q3,1,0.373,,0.1765,,0.3141,correct,1.0,"Stem sử dụng trạng từ ""once"" để chỉ một hành động đã hoàn thành tại một thời điểm không xác định trong quá khứ, điều này đòi hỏi động từ phải ở thì quá khứ đơn. Do đó, ""cleared"" (c) là lựa chọn duy nhất phù hợp về mặt ngữ pháp.",correct,1.0,"Stem có 'once' (một thời điểm trong quá khứ) và 'easily' chỉ hành động hoàn thành, nên cần thì quá khứ đơn. Option c 'cleared' phù hợp rõ ràng, các option khác (a hiện tại đơn, b số ít sai, d hiện tại hoàn thành) đều bị loại."
race50_mcq_hehe1,minimal,Past Simple,mcq,0,4944d8acfc6dd5bbcd830a8e627fa520fced7bfe7623fb5782a8711ce0aa43ab,4,eng_past_simple_04,q4,1,0.6401,,0.4765,,0.591,correct,1.0,"Động từ chính của câu ""hoped"" ở thì quá khứ đơn, do đó theo quy tắc về sự hòa hợp thì (sequence of tenses), động từ trong mệnh đề phụ cũng phải lùi về thì quá khứ. Vì vậy, ""was"" (b) là lựa chọn duy nhất đúng về mặt ngữ pháp.",correct,1.0,"Stem có 'hoped' (quá khứ) và 'said' (quá khứ) chỉ ra hành động xảy ra trong quá khứ, nên động từ trong mệnh đề that cần chia ở thì quá khứ đơn 'was' để phù hợp với trình tự thời gian."
race50_mcq_hehe1,minimal,Past Simple,mcq,0,4944d8acfc6dd5bbcd830a8e627fa520fced7bfe7623fb5782a8711ce0aa43ab,5,eng_past_simple_05,q5,1,0.5506,,0.1837,,0.4405,correct,1.0,"Mệnh đề trạng ngữ chỉ thời gian ""Before turning fifty"" xác định một thời điểm trong quá khứ, do đó động từ chính của câu phải được chia ở thì quá khứ. Lựa chọn (b) ""thought"" là thì quá khứ đơn, phù hợp với ngữ cảnh này.",correct,1.0,"Stem có 'Before turning fifty' chỉ thời gian quá khứ rõ ràng, và 'was' xác nhận ngữ cảnh quá khứ. Option b 'thought' phù hợp với thì quá khứ đơn, trong khi các option khác (a, c, d) không phù hợp về thì hoặc hình thức ngữ pháp."
race50_mcq_hehe1,cot,Past Simple,mcq,0,4944d8acfc6dd5bbcd830a8e627fa520fced7bfe7623fb5782a8711ce0aa43ab,1,eng_past_simple_01,ps_001,1,0.748,,0.1752,,0.5762,ambiguous,0.5,"Trạng từ ""recently"" trong câu có thể được sử dụng với cả thì Quá khứ đơn (phương án c) và Hiện tại hoàn thành (phương án d). Không có thêm ngữ cảnh để phân biệt, cả hai phương án đều đúng ngữ pháp và hợp lý về mặt ngữ nghĩa.",ambiguous,0.5,"Stem có 'recently' có thể dùng với cả Past Simple (c) và Present Perfect (d), cả hai đều hợp lý về ngữ pháp và nghĩa mà không có tín hiệu rõ ràng để loại trừ một trong hai."
race50_mcq_hehe1,cot,Past Simple,mcq,0,4944d8acfc6dd5bbcd830a8e627fa520fced7bfe7623fb5782a8711ce0aa43ab,2,eng_past_simple_02,ps_002,1,0.5915,,0.2114,,0.4775,correct,1.0,"Trạng từ chỉ thời gian ""A few days ago"" trong câu gốc chỉ một hành động đã hoàn tất tại một thời điểm cụ thể trong quá khứ, do đó yêu cầu sử dụng thì quá khứ đơn. Lựa chọn ""c"" (tried) là lựa chọn duy nhất phù hợp về mặt ngữ pháp.",correct,1.0,"Stem có 'a few days ago' chỉ thời gian quá khứ xác định, nên chỉ có option 'tried' (quá khứ đơn) phù hợp rõ ràng; các option khác đều ở thì hiện tại nên bị loại."
race50_mcq_hehe1,cot,Past Simple,mcq,0,4944d8acfc6dd5bbcd830a8e627fa520fced7bfe7623fb5782a8711ce0aa43ab,3,eng_past_simple_03,ps_003,1,0.3502,,0.2269,,0.3132,correct,1.0,"Trạng từ ""once"" trong câu chỉ một hành động đã hoàn tất tại một thời điểm cụ thể trong quá khứ, do đó yêu cầu sử dụng thì quá khứ đơn. Lựa chọn (b) ""cleared"" là dạng đúng duy nhất cho thì này.",correct,1.0,"Stem có 'once' chỉ hành động hoàn thành trong quá khứ, nên thì quá khứ đơn (cleared) là phù hợp rõ ràng; các option khác dùng thì hiện tại hoặc hiện tại hoàn thành không phù hợp với 'once'."
race50_mcq_hehe1,cot,Past Simple,mcq,0,4944d8acfc6dd5bbcd830a8e627fa520fced7bfe7623fb5782a8711ce0aa43ab,4,eng_past_simple_04,ps_004,1,0.8719,,0.1649,,0.6598,ambiguous,0.5,"Stem không cung cấp đủ ngữ cảnh về thời gian. Cả thì quá khứ đơn (b) 'considered' để nói về một sự thật lịch sử, và thì hiện tại đơn (a) 'considers' để phân tích quan điểm trong tác phẩm văn học (literary present), đều có thể chấp nhận được.",incorrect,0.0,"Stem không cung cấp bất kỳ dấu hiệu thời gian nào để xác định thì động từ, không có trạng từ thời gian, ngữ cảnh lịch sử, hay mệnh đề phụ để phân biệt giữa các thì quá khứ, hiện tại hoặc hoàn thành. Tất cả các option đều có thể phù hợp về mặt ngữ pháp với stem này."
race50_mcq_hehe1,cot,Past Simple,mcq,0,4944d8acfc6dd5bbcd830a8e627fa520fced7bfe7623fb5782a8711ce0aa43ab,5,eng_past_simple_05,ps_005,1,0.4321,,0.1972,,0.3616,correct,1.0,"Stem dùng ""when"" để liên kết một trạng thái và một hành động xảy ra đồng thời trong quá khứ. Do đó, cả hai động từ phải cùng ở thì quá khứ đơn, khiến ""was / said"" (b) là lựa chọn duy nhất phù hợp về mặt ngữ pháp và ngữ nghĩa.",correct,1.0,"Stem có dấu hiệu thời gian quá khứ rõ ràng với động từ 'was' và 'said' phù hợp với câu trích dẫn trong ngoặc kép, trong khi các lựa chọn khác vi phạm sự nhất quán thời gian hoặc ngữ pháp."
race50_mcq_hehe1,minimal,Present Simple,mcq,0,d425116ba3c1135e0af157a93de08f70202186c1bf7c5b545684acdb66c7ea7b,1,ps_001,q1,1,0.7394,,0.4209,,0.6439,ambiguous,0.5,"Stem hỏi về sở thích của một người nhưng không cung cấp bất kỳ ngữ cảnh hay thông tin nào để xác định câu trả lời đúng. Tất cả các phương án a, b, c, và d đều là những câu trả lời hợp lý về mặt ngữ nghĩa và ngữ pháp.",ambiguous,0.5,"Stem không cung cấp thông tin nào về sở thích của Tommy's father, nên không thể xác định option nào phù hợp dựa trên stem. Tất cả các option đều có thể chấp nhận như nhau."
race50_mcq_hehe1,minimal,Present Simple,mcq,0,d425116ba3c1135e0af157a93de08f70202186c1bf7c5b545684acdb66c7ea7b,2,ps_002,q2,1,0.5858,,0.5405,,0.5722,ambiguous,0.5,"Câu hỏi không cung cấp bất kỳ thông tin hay ngữ cảnh nào để xác định sở thích của mẹ Tommy. Do đó, không có cơ sở để chọn một đáp án duy nhất trong số các lựa chọn được đưa ra.",ambiguous,0.5,"Stem không cung cấp thông tin nào về sở thích của mẹ Tommy, nên không thể xác định option nào phù hợp dựa trên ràng buộc ngữ pháp hoặc ngữ nghĩa từ câu hỏi."
race50_mcq_hehe1,minimal,Present Simple,mcq,0,d425116ba3c1135e0af157a93de08f70202186c1bf7c5b545684acdb66c7ea7b,3,ps_003,q3,1,0.4902,,0.452,,0.4787,ambiguous,0.5,"Stem là một câu hỏi mở không cung cấp bất kỳ thông tin hay ngữ cảnh nào về sở thích của Tommy. Do đó, không có cơ sở để xác định một câu trả lời duy nhất đúng trong số các lựa chọn đều hợp lý như nhau.",ambiguous,0.5,"Stem không cung cấp bất kỳ thông tin nào về sở thích của Tommy, nên không có cơ sở để xác định hoặc loại trừ bất kỳ option nào dựa trên ngữ cảnh được cho."
race50_mcq_hehe1,minimal,Present Simple,mcq,0,d425116ba3c1135e0af157a93de08f70202186c1bf7c5b545684acdb66c7ea7b,4,ps_004,q4,1,0.6999,,0.4722,,0.6316,incorrect,0.0,Stem là một câu hỏi yêu cầu thông tin cụ thể ('Which vegetables...') nhưng lại không cung cấp bất kỳ ngữ cảnh hay dữ kiện nào để trả lời. Không có cơ sở để xác định 'Carrots' (c) là đáp án đúng duy nhất so với các lựa chọn rau củ khác là (a) và (b).,ambiguous,0.5,"Stem không cung cấp bất kỳ thông tin nào về sở thích của bố mẹ Tommy, không có ngữ cảnh hay manh mối để xác định loại rau cụ thể nào họ thích. Tất cả các option a, b, c đều là rau củ hợp lệ về mặt ngữ nghĩa, trong khi d (dâu tây) là trái cây nên có thể loại, nhưng không có cơ sở để chọn giữa a, b, c."
race50_mcq_hehe1,minimal,Present Simple,mcq,0,d425116ba3c1135e0af157a93de08f70202186c1bf7c5b545684acdb66c7ea7b,5,ps_005,q5,1,0.528,,0.4089,,0.4923,ambiguous,0.5,"Stem là một câu hỏi yêu cầu thông tin cụ thể (sở thích của Tommy), nhưng không có bất kỳ ngữ cảnh hay đoạn văn nào được cung cấp để trả lời. Tất cả các lựa chọn đều có khả năng là câu trả lời đúng.",ambiguous,0.5,"Stem không cung cấp thông tin nào về sở thích của Tommy, nên không thể xác định option nào là đúng dựa trên ràng buộc ngữ pháp hoặc ngữ nghĩa từ câu hỏi."
race50_mcq_hehe1,cot,Present Simple,mcq,0,d425116ba3c1135e0af157a93de08f70202186c1bf7c5b545684acdb66c7ea7b,1,ps_001,ps_001,1,1.0,,0.1917,,0.7575,correct,1.0,"Stem có chủ ngữ ngôi thứ ba số ít (""Tommy's father"") và diễn tả một sở thích chung, đòi hỏi động từ ở thì hiện tại đơn phải thêm '-s'. Chỉ có phương án ""b"" (""likes"") đáp ứng đúng quy tắc ngữ pháp này.",correct,1.0,"Stem có chủ ngữ số ít 'Tommy's father' và trạng từ 'very much' chỉ thói quen, nên cần động từ chia ở thì hiện tại đơn số ít. Option b 'likes' phù hợp rõ ràng, các option khác không đúng: a thiếu -s, c sai thì, d sai thời gian."
race50_mcq_hehe1,cot,Present Simple,mcq,0,d425116ba3c1135e0af157a93de08f70202186c1bf7c5b545684acdb66c7ea7b,2,ps_002,ps_002,1,0.8515,,0.2219,,0.6626,correct,1.0,"Stem có chủ ngữ ngôi thứ ba số ít ""Tommy"", yêu cầu động từ ở thì hiện tại đơn phải chia tương ứng. Chỉ có đáp án (b) ""doesn't like"" là đúng về mặt ngữ pháp này.",correct,1.0,"Stem chỉ chủ ngữ 'Tommy' (ngôi 3 số ít) và không có dấu hiệu thời gian khác, nên thì hiện tại đơn với trợ động từ 'doesn't' là phù hợp rõ ràng; các lựa chọn khác vi phạm ngữ pháp (a: 'don't' không khớp ngôi, c: 'isn't liking' không dùng cho động từ chỉ sở thích, d: 'didn't like' là quá khứ nhưng stem không gợi ý thời gian quá khứ)."
race50_mcq_hehe1,cot,Present Simple,mcq,0,d425116ba3c1135e0af157a93de08f70202186c1bf7c5b545684acdb66c7ea7b,3,ps_003,ps_003,1,0.7507,,0.1917,,0.583,correct,1.0,"Chủ ngữ ""Tommy's mother"" là ngôi thứ ba số ít, do đó động từ ở thì hiện tại đơn phải thêm ""-s"". Lựa chọn ""b"" (""likes"") là phương án duy nhất đúng về mặt ngữ pháp để diễn tả một sở thích chung.",correct,1.0,"Stem chỉ chủ ngữ số ít 'Tommy's mother' và không có dấu hiệu thời gian quá khứ hay tiếp diễn, nên 'likes' (Present Simple ngôi thứ ba số ít) là phù hợp rõ ràng; các option khác không đúng ngữ pháp hoặc thì."
