run_id,config,topic,type,seed,source_text_sha,idx,qid_gold,qid_pred,structural_valid,question_sim,ans_sim,distractor_diversity,ans_score,item_score,judge_verdict,judge_score,judge_why,judge2_verdict,judge2_score,judge2_why
race50_mcq_hehe1,minimal,Direct vs Indirect questions,mcq,0,b056d77ab82ac63c135567e6426f455adfad5d091bdfc8b980ad210eecb5fa1b,1,goat_dq_01,q1,1,0.6661,,0.0185,,0.4718,correct,1.0,"Stem yêu cầu chuyển câu hỏi trực tiếp sang câu hỏi gián tiếp, đòi hỏi phải lùi thì (present simple → past simple) và chuyển sang trật tự từ khẳng định. Phương án (b) '...how much land you had available' là lựa chọn duy nhất tuân thủ cả hai quy tắc này.",correct,1.0,"Stem yêu cầu chuyển câu hỏi trực tiếp sang câu hỏi gián tiếp, với ràng buộc ngữ pháp: đảo ngữ trong mệnh đề hỏi phải được khôi phục (chủ ngữ + động từ), và thì động từ cần phù hợp với động từ dẫn 'asked'. Chỉ option b ('how much land you had available') tuân thủ đúng cả hai quy tắc: không đảo ngữ và lùi thì 'had' từ 'do you have'."
race50_mcq_hehe1,minimal,Direct vs Indirect questions,mcq,0,b056d77ab82ac63c135567e6426f455adfad5d091bdfc8b980ad210eecb5fa1b,2,goat_dq_02,q2,1,0.5145,,0.0507,,0.3754,correct,1.0,"Câu gốc là câu hỏi Yes/No, khi chuyển sang câu gián tiếp cần dùng 'if' hoặc 'whether', đổi trật tự từ thành dạng câu trần thuật (S+V) và lùi thì. Lựa chọn 'a' là lựa chọn duy nhất tuân thủ tất cả các quy tắc này (dùng 'if', chủ ngữ 'you' đứng trước động từ 'understood', và lùi thì từ 'understand' thành 'understood' và 'has to' thành 'had to').",correct,1.0,"Stem yêu cầu chuyển câu hỏi trực tiếp sang câu hỏi gián tiếp với quy tắc ngữ pháp: đảo ngữ 'do you' thành 'if you', lùi thì 'understand' → 'understood' và 'has to' → 'had to'. Chỉ option a tuân thủ đúng tất cả quy tắc này; các option khác sai về trật tự từ (b), thì (c), hoặc cấu trúc 'asked that' (d)."
race50_mcq_hehe1,minimal,Direct vs Indirect questions,mcq,0,b056d77ab82ac63c135567e6426f455adfad5d091bdfc8b980ad210eecb5fa1b,3,goat_dq_03,q3,1,0.574,,0.0271,,0.4099,correct,1.0,"Stem yêu cầu chuyển câu hỏi Yes/No trực tiếp sang gián tiếp, đòi hỏi phải dùng 'if', đổi sang trật tự từ khẳng định và lùi thì do động từ tường thuật 'asked' ở quá khứ. Phương án 'a' ('if you had... you planned...') là lựa chọn duy nhất áp dụng đúng tất cả các quy tắc này.",correct,1.0,"Stem yêu cầu chuyển câu hỏi trực tiếp 'Do you have...' sang câu hỏi gián tiếp. Option a tuân thủ đúng quy tắc: chuyển 'do you have' → 'if you had' và 'you plan' → 'you planned' (lùi thì). Các option khác sai: b thừa 'did', c không lùi thì, d dùng 'that' thay vì 'if' cho câu hỏi Yes/No."
race50_mcq_hehe1,minimal,Direct vs Indirect questions,mcq,0,b056d77ab82ac63c135567e6426f455adfad5d091bdfc8b980ad210eecb5fa1b,4,goat_dq_04,q4,1,0.5386,,0.0382,,0.3885,correct,1.0,"Stem yêu cầu chuyển câu hỏi trực tiếp (yes/no) sang câu hỏi gián tiếp với động từ tường thuật ở thì quá khứ (""wondered""). Điều này đòi hỏi phải dùng ""if"", chuyển sang trật tự từ khẳng định (chủ ngữ + động từ), và lùi thì từ hiện tại đơn (""have"") về quá khứ đơn (""had""). Chỉ có phương án 'a' (""if you had"") đáp ứng đúng tất cả các yêu cầu ngữ pháp này.",correct,1.0,"Stem yêu cầu chuyển câu hỏi trực tiếp 'Do you have...' sang câu gián tiếp với cấu trúc 'They wondered if...' và động từ phải lùi thì (have → had). Chỉ option a đáp ứng đủ: 'if you had' đúng cấu trúc và thì; các option khác sai vì dùng 'did you have' (đảo ngữ không cần thiết), 'you have' (không lùi thì), hoặc 'that you had' (sai từ nối cho câu hỏi)."
race50_mcq_hehe1,minimal,Direct vs Indirect questions,mcq,0,b056d77ab82ac63c135567e6426f455adfad5d091bdfc8b980ad210eecb5fa1b,5,goat_dq_05,q5,1,0.5273,,0.0597,,0.387,correct,1.0,"Câu gốc là câu hỏi lựa chọn, khi chuyển sang câu gián tiếp cần dùng 'whether...or...' và cấu trúc câu trần thuật (chủ ngữ + động từ). Lựa chọn (a) là lựa chọn duy nhất tuân thủ đúng quy tắc này với cấu trúc 'whether you would get...'.",correct,1.0,"Stem yêu cầu chuyển câu hỏi trực tiếp sang dạng gián tiếp, chỉ có option a tuân thủ đúng quy tắc ngữ pháp: dùng 'whether' và đảo chủ ngữ-động từ ('you would get') thay vì dạng câu hỏi."
race50_mcq_hehe1,cot,Direct vs Indirect questions,mcq,0,b056d77ab82ac63c135567e6426f455adfad5d091bdfc8b980ad210eecb5fa1b,1,goat_dq_01,diq_001,1,0.5039,,0.0477,,0.3671,correct,1.0,"Stem 'The experts want to know...' yêu cầu một mệnh đề danh từ dưới dạng câu hỏi gián tiếp, vốn phải tuân theo trật tự từ của câu trần thuật (chủ ngữ + động từ). Lựa chọn (b) 'how much land you have' là phương án duy nhất tuân thủ đúng cấu trúc này.",correct,1.0,"Stem yêu cầu cấu trúc câu gián tiếp (indirect question) sau 'know', do đó động từ phải theo trật tự chủ ngữ + động từ. Option b 'how much land you have' tuân thủ đúng quy tắc này, trong khi các option khác sử dụng trật tự câu hỏi trực tiếp hoặc thừa trợ động từ."
race50_mcq_hehe1,cot,Direct vs Indirect questions,mcq,0,b056d77ab82ac63c135567e6426f455adfad5d091bdfc8b980ad210eecb5fa1b,2,goat_dq_02,diq_002,1,0.4698,,0.1009,,0.3591,correct,1.0,"Stem ""They asked ___"" giới thiệu một câu hỏi gián tiếp, yêu cầu cấu trúc mệnh đề khẳng định (chủ ngữ + động từ). Cả hai lựa chọn 'b' (if you understand) và 'c' (whether you understand) đều tuân thủ quy tắc này và phù hợp về mặt ngữ pháp, do đó đáp án 'd' (b and c are correct) là chính xác.",correct,1.0,"Stem yêu cầu cấu trúc câu gián tiếp với động từ 'asked'. Option b 'if you understand' và option c 'whether you understand' đều đúng ngữ pháp và có thể thay thế cho nhau trong ngữ cảnh này, trong khi option a sai vì đảo ngữ 'do you' chỉ dùng trong câu trực tiếp."
race50_mcq_hehe1,cot,Direct vs Indirect questions,mcq,0,b056d77ab82ac63c135567e6426f455adfad5d091bdfc8b980ad210eecb5fa1b,3,goat_dq_03,diq_003,1,0.4976,,0.163,,0.3972,correct,1.0,"Stem ""I wonder..."" giới thiệu một câu hỏi gián tiếp, yêu cầu cấu trúc 'từ để hỏi + chủ ngữ + động từ'. Chỉ có option (b) ""how good"" tạo thành cấu trúc đúng ngữ pháp ""...how good the land is..."".",correct,1.0,"Stem yêu cầu cấu trúc câu hỏi gián tiếp (indirect question) nên không đảo ngữ. Option 'b' (how good) đúng vì theo sau là mệnh đề 'the land is for supporting goats' hoàn chỉnh, trong khi các option khác sai ngữ pháp: 'a' đảo ngữ, 'c' sai trật tự từ, 'd' thừa 'it'."
race50_mcq_hehe1,cot,Direct vs Indirect questions,mcq,0,b056d77ab82ac63c135567e6426f455adfad5d091bdfc8b980ad210eecb5fa1b,4,goat_dq_04,diq_004,1,0.7021,,0.2325,,0.5612,correct,1.0,"Câu gốc là một câu hỏi gián tiếp bắt đầu bằng ""Could you tell me..."", do đó mệnh đề theo sau phải có cấu trúc của một câu trần thuật (chủ ngữ + động từ). Chỉ có phương án (a) ""if you have"" tuân thủ đúng quy tắc ngữ pháp này.",correct,1.0,"Stem yêu cầu cấu trúc câu gián tiếp với động từ 'tell me + if/whether + chủ ngữ + động từ'. Chỉ option A 'if you have' tuân thủ đúng quy tắc ngữ pháp này, các option khác đều sai vì đảo ngữ không hợp lệ trong câu gián tiếp."
race50_mcq_hehe1,cot,Direct vs Indirect questions,mcq,0,b056d77ab82ac63c135567e6426f455adfad5d091bdfc8b980ad210eecb5fa1b,5,goat_dq_05,diq_005,1,0.4418,,0.1656,,0.3589,correct,1.0,"Stem yêu cầu một mệnh đề câu hỏi gián tiếp giới thiệu hai lựa chọn (""... or ...""). Cấu trúc này đòi hỏi trật tự từ xuôi (chủ ngữ + động từ) và ưu tiên dùng ""whether"". Do đó, ""whether you will"" (b) là lựa chọn chính xác nhất, trong khi (c) và (d) sai trật tự từ và (a) kém trang trọng/chính xác hơn trong ngữ cảnh này.",incorrect,0.0,"Stem yêu cầu cấu trúc câu gián tiếp đúng ngữ pháp. Cả option a và b đều đúng về mặt ngữ pháp ('if/whether + S + will'), không có tín hiệu nào trong stem để loại trừ 'if' hay ưu tiên 'whether'. Do đó, không thể xác định duy nhất option b là đáp án đúng."
race50_mcq_hehe1,minimal,Zero Conditional,mcq,0,33c4b351e87003e9de0fb327d9efb90767ab8f9e05601b19523d422291b8e9fe,1,ENG-ZCOND-001,q1,1,0.6884,,0.1497,,0.5268,ambiguous,0.5,"Mệnh đề 'if' sử dụng thì hiện tại đơn, cho phép cả cấu trúc câu điều kiện loại 0 (diễn tả sự thật chung) và loại 1 (diễn tả khả năng trong tương lai). Do đó, cả phương án (b) 'become weak' (hiện tại đơn) và (a) 'will become weak' (tương lai đơn) đều phù hợp về mặt ngữ pháp và ngữ nghĩa, và câu gốc không cung cấp đủ ngữ cảnh để loại trừ một trong hai.",incorrect,0.0,"Stem mô tả một sự thật phổ quát (zero conditional) nên cần thì hiện tại đơn; cả option a và b đều có thể chấp nhận vì không có ngữ cảnh rõ ràng để phân biệt giữa 'will' (dự đoán) và hiện tại đơn (sự thật), trong khi đáp án gán là b."
race50_mcq_hehe1,minimal,Zero Conditional,mcq,0,33c4b351e87003e9de0fb327d9efb90767ab8f9e05601b19523d422291b8e9fe,2,ENG-ZCOND-002,q2,1,0.6035,,0.1638,,0.4716,ambiguous,0.5,"Mệnh đề điều kiện với 'When' ở thì hiện tại đơn có thể đi với cả thì hiện tại đơn (diễn tả sự thật hiển nhiên) và thì tương lai đơn (diễn tả một kết quả có thể xảy ra trong tương lai). Do đó, cả hai phương án 'slowly become' (a) và 'will slowly become' (b) đều hợp lý về mặt ngữ pháp và ngữ nghĩa mà không có ngữ cảnh để loại trừ.",incorrect,0.0,"Stem thiếu dấu hiệu thời gian rõ ràng để xác định câu điều kiện loại nào. Cả 'a' (zero conditional) và 'b' (first conditional) đều có thể chấp nhận được trong ngữ cảnh này, không có bằng chứng ngữ pháp nào trong stem để loại trừ 'b'."
race50_mcq_hehe1,minimal,Zero Conditional,mcq,0,33c4b351e87003e9de0fb327d9efb90767ab8f9e05601b19523d422291b8e9fe,3,ENG-ZCOND-003,q3,1,0.5272,,0.2008,,0.4293,correct,1.0,"Mệnh đề 'if' sử dụng thì hiện tại đơn ('says') để diễn tả một sự thật chung hoặc một điều kiện tổng quát, do đó mệnh đề chính cũng cần dùng thì hiện tại đơn ('keeps') để chỉ một kết quả thường xuyên hoặc một thói quen, tuân theo cấu trúc câu điều kiện loại 0.",correct,1.0,"Stem thể hiện tình huống chung (zero conditional) với 'if someone says' chỉ thói quen/sự thật, nên động từ chính cần thì hiện tại đơn. Option 'a' (keeps) phù hợp rõ ràng, các option khác sai về thì."
race50_mcq_hehe1,minimal,Zero Conditional,mcq,0,33c4b351e87003e9de0fb327d9efb90767ab8f9e05601b19523d422291b8e9fe,4,ENG-ZCOND-004,q4,1,0.9263,,0.1915,,0.7059,correct,1.0,"Câu đầu bài sử dụng thì hiện tại đơn (""says"", ""means"") để diễn tả một sự thật chung, tương ứng với cấu trúc câu điều kiện loại 0. Do đó, động từ ở mệnh đề sau cũng cần ở thì hiện tại đơn (""doesn't give"") để duy trì tính nhất quán về mặt ngữ pháp và ngữ nghĩa.",ambiguous,0.5,Stem thiếu tín hiệu thời gian rõ ràng để phân biệt giữa thói quen chung (a) và hành động trong quá khứ (c). Cả 'doesn't give' (thói quen hiện tại) và 'didn't give' (quá khứ) đều có thể phù hợp với ngữ cảnh 'memory is poor' mà không có dấu hiệu ngữ pháp quyết định.
race50_mcq_hehe1,minimal,Zero Conditional,mcq,0,33c4b351e87003e9de0fb327d9efb90767ab8f9e05601b19523d422291b8e9fe,5,ENG-ZCOND-005,q5,1,0.4401,,0.2803,,0.3922,correct,1.0,"Mệnh đề 'if' sử dụng thì hiện tại đơn ('complains') để diễn tả một tình huống chung, có tính lặp lại. Do đó, mệnh đề chính cần một động từ ở thì hiện tại đơn ('know') để tạo thành câu điều kiện loại 0, diễn tả một sự thật hiển nhiên hoặc một thói quen.",incorrect,0.0,"Stem mô tả một tình huống chung (zero conditional) với mệnh đề chính cần thì hiện tại đơn để diễn tả sự thật hiển nhiên, nhưng option 'a' (know) không phải là lựa chọn duy nhất phù hợp; option 'b' (will know) cũng có thể chấp nhận được nếu hiểu là phản ứng tương lai khi nghe lời phàn nàn, làm mất tính duy nhất của đáp án."
race50_mcq_hehe1,cot,Zero Conditional,mcq,0,33c4b351e87003e9de0fb327d9efb90767ab8f9e05601b19523d422291b8e9fe,1,ENG-ZCOND-001,zc_001,1,0.8799,,0.198,,0.6753,correct,1.0,"Mệnh đề ""If"" trong câu sử dụng thì hiện tại đơn (""don't use"") để diễn tả một sự thật hiển nhiên, một quy luật khoa học. Do đó, đây là câu điều kiện loại 0, và mệnh đề chính cũng phải ở thì hiện tại đơn, khiến cho ""become"" (a) là lựa chọn phù hợp nhất.",ambiguous,0.5,Stem thiếu dấu hiệu thời gian rõ ràng để phân biệt giữa zero conditional (a) và first conditional (b). Cả 'become' và 'will become' đều có thể chấp nhận được trong ngữ cảnh này mà không có thông tin bổ sung.
race50_mcq_hehe1,cot,Zero Conditional,mcq,0,33c4b351e87003e9de0fb327d9efb90767ab8f9e05601b19523d422291b8e9fe,2,ENG-ZCOND-002,zc_002,1,0.812,,0.2036,,0.6295,correct,1.0,"Câu diễn tả một sự thật hiển nhiên (zero conditional), với mệnh đề 'when' chia ở thì hiện tại đơn (exercises), do đó mệnh đề chính cũng phải ở thì hiện tại đơn. Lựa chọn 'a' (stays) là phù hợp nhất với cấu trúc này.",ambiguous,0.5,Stem thiếu tín hiệu thời gian rõ ràng để phân biệt giữa zero conditional (a) và first conditional (b). Cả 'stays' và 'will stay' đều có thể chấp nhận được trong ngữ cảnh này mà không có bằng chứng ngữ pháp để loại trừ hoàn toàn option nào.
race50_mcq_hehe1,cot,Zero Conditional,mcq,0,33c4b351e87003e9de0fb327d9efb90767ab8f9e05601b19523d422291b8e9fe,3,ENG-ZCOND-003,zc_003,1,0.5988,,0.1644,,0.4685,correct,1.0,"Stem diễn tả một sự thật khoa học, yêu cầu sử dụng câu điều kiện loại 0 (If + present simple, present simple). Mệnh đề 'if' đã dùng thì hiện tại đơn ('heat'), do đó mệnh đề chính cũng phải dùng thì hiện tại đơn, khiến 'a' (melts) là lựa chọn duy nhất đúng về mặt ngữ pháp và ngữ nghĩa.",ambiguous,0.5,Stem thiếu ngữ cảnh thời gian rõ ràng để phân biệt giữa zero conditional (melts) và first conditional (will melt). Cả hai option a và b đều có thể chấp nhận mà không có bằng chứng ngữ pháp để loại trừ hoàn toàn.
race50_mcq_hehe1,cot,Zero Conditional,mcq,0,33c4b351e87003e9de0fb327d9efb90767ab8f9e05601b19523d422291b8e9fe,4,ENG-ZCOND-004,zc_004,1,0.5521,,0.134,,0.4267,correct,1.0,"Stem diễn tả một sự thật hiển nhiên/quy luật tự nhiên (""Plants die...""), yêu cầu cấu trúc câu điều kiện loại 0 (Zero Conditional). Do đó, mệnh đề ""if"" phải ở thì hiện tại đơn, và chỉ có phương án ""a"" (""don't get"") đáp ứng được yêu cầu ngữ pháp này.",correct,1.0,"Stem thể hiện điều kiện chung (zero conditional) với mệnh đề chính ở thì hiện tại đơn, nên mệnh đề if cũng cần thì hiện tại đơn; chỉ option A 'don't get' phù hợp, các option khác dùng thì tương lai hoặc quá khứ không phù hợp với quy tắc zero conditional."
race50_mcq_hehe1,cot,Zero Conditional,mcq,0,33c4b351e87003e9de0fb327d9efb90767ab8f9e05601b19523d422291b8e9fe,5,ENG-ZCOND-005,zc_005,1,0.4401,,0.2419,,0.3806,correct,1.0,"Mệnh đề 'if' sử dụng thì hiện tại đơn ('complains') để diễn tả một tình huống chung, có tính quy luật. Do đó, đây là câu điều kiện loại 0, yêu cầu mệnh đề chính cũng ở thì hiện tại đơn ('know') để diễn tả một sự thật hiển nhiên hoặc một kết quả logic.",incorrect,0.0,"Stem thiếu dấu hiệu thời gian rõ ràng để xác định câu điều kiện loại nào. Cả 'know' (zero conditional) và 'would know' (second conditional) đều có thể phù hợp tùy ngữ cảnh, không có bằng chứng loại trừ option nào."
race50_mcq_hehe1,minimal,Zero Conditional,mcq,0,7b3cfeeefbeb27047622322081673cbe6b27983ce3165e86eca027d54214e662,1,eng_vn_zero_cond_001,q1,1,0.3605,,0.3159,,0.3472,ambiguous,0.5,"Câu hỏi yêu cầu kiến thức thực tế về hành vi của loài chó để chọn đáp án đúng, thông tin này không được cung cấp trong câu dẫn. Về mặt ngôn ngữ, tất cả các lựa chọn đều là những hành động mà một con chó có thể thực hiện, và không có cơ sở nào trong câu dẫn để loại trừ các phương án.",correct,1.0,"Stem yêu cầu hành vi của chó khi tức giận. Option c (nhe răng) là dấu hiệu hung hăng rõ ràng, trong khi các option khác mô tả trạng thái vui (a), cảnh giác (b), hoặc sợ hãi (d) - không phù hợp với ngữ cảnh 'angry'."
race50_mcq_hehe1,minimal,Zero Conditional,mcq,0,7b3cfeeefbeb27047622322081673cbe6b27983ce3165e86eca027d54214e662,2,eng_vn_zero_cond_002,q2,1,0.3137,,0.4029,,0.3405,ambiguous,0.5,"Thân bài hỏi về một phản ứng chung khi một con chó sợ hãi. Cả phương án (b), nhe răng như một phản ứng tự vệ, và phương án (d), cụp tai và đuôi như một phản ứng phục tùng, đều là những hành vi hợp lý và phổ biến. Thân bài thiếu ngữ cảnh để xác định duy nhất một câu trả lời đúng.",correct,1.0,"Stem yêu cầu mô tả hành vi khi chó sợ hãi. Option d mô tả đặc điểm điển hình của chó sợ hãi (cụp tai, giấu đuôi), trong khi các option khác (a: vẫy đuôi thường biểu thị vui mừng; b: nhe răng thường biểu thị hung hăng; c: chân khỏe không liên quan đến sợ hãi) không phù hợp với ngữ cảnh sợ hãi."
race50_mcq_hehe1,minimal,Zero Conditional,mcq,0,7b3cfeeefbeb27047622322081673cbe6b27983ce3165e86eca027d54214e662,3,eng_vn_zero_cond_003,q3,1,0.3303,,0.299,,0.3209,ambiguous,0.5,"Stem yêu cầu một hành động mà một con chó 'luôn luôn' (always) làm khi vui. Tuy nhiên, không có lựa chọn nào đáp ứng được điều kiện tuyệt đối này, vì hành vi của động vật rất đa dạng và không phải lúc nào một con chó vui cũng vẫy đuôi, khiến câu hỏi trở nên mơ hồ và phải dựa vào kiến thức chung đã được đơn giản hóa.",ambiguous,0.5,"Stem yêu cầu hành động 'luôn luôn' xảy ra khi chó vui, nhưng không có bằng chứng ngữ cảnh hoặc kiến thức chuyên môn để khẳng định chỉ một hành động duy nhất (vd: vẫy đuôi) là luôn đúng, vì chó có thể biểu lộ hạnh phúc bằng nhiều cách khác nhau tùy tình huống."
race50_mcq_hehe1,minimal,Zero Conditional,mcq,0,7b3cfeeefbeb27047622322081673cbe6b27983ce3165e86eca027d54214e662,4,eng_vn_zero_cond_004,q4,1,0.2925,,0.4621,,0.3434,ambiguous,0.5,Câu hỏi yêu cầu kiến thức thực tế về sự phát triển của chó con mà không cung cấp bất kỳ thông tin nào trong văn bản. Không thể xác định được đáp án đúng chỉ dựa vào stem và các lựa chọn.,ambiguous,0.5,"Stem không cung cấp thông tin cụ thể về sự phát triển của chó con 2 tuần tuổi, và không có ràng buộc ngữ pháp hoặc ngữ nghĩa rõ ràng để loại trừ các lựa chọn a, c, d so với b."
race50_mcq_hehe1,minimal,Zero Conditional,mcq,0,7b3cfeeefbeb27047622322081673cbe6b27983ce3165e86eca027d54214e662,5,eng_vn_zero_cond_005,q5,1,0.3091,,0.446,,0.3502,correct,1.0,"Stem hỏi về một hành động mà chó con bắt đầu làm khi được bốn tuần tuổi. Option (c) mô tả một cột mốc phát triển phù hợp ('bắt đầu ăn thức ăn mềm'), trực tiếp trả lời cho câu hỏi 'what do they start doing?', trong khi các lựa chọn khác không phù hợp về mặt hành động hoặc thời điểm.",correct,1.0,"Stem chỉ ra mốc 4 tuần tuổi, option c phù hợp rõ ràng vì chó con thường bắt đầu ăn thức ăn mềm ở giai đoạn này, trong khi các option khác (a, b, d) mô tả đặc điểm không phù hợp với độ tuổi đã cho."
race50_mcq_hehe1,cot,Zero Conditional,mcq,0,7b3cfeeefbeb27047622322081673cbe6b27983ce3165e86eca027d54214e662,1,eng_vn_zero_cond_001,zc_001,1,0.4041,,0.4113,,0.4063,correct,1.0,"Mệnh đề chính ""it opens its mouth..."" sử dụng thì hiện tại đơn để diễn tả một sự thật hiển nhiên (general truth). Điều này yêu cầu mệnh đề 'if' cũng phải ở thì hiện tại đơn để tạo thành câu điều kiện loại 0, do đó chỉ có phương án 'is' là phù hợp.",correct,1.0,"Câu thuộc cấu trúc Zero Conditional diễn tả sự thật hiển nhiên, đòi hỏi thì hiện tại đơn ở cả hai mệnh đề. Option 'a' (is) phù hợp rõ ràng, trong khi các option khác sử dụng thì quá khứ, tương lai, hoặc hiện tại hoàn thành đều không phù hợp với quy tắc ngữ pháp của Zero Conditional."
race50_mcq_hehe1,cot,Zero Conditional,mcq,0,7b3cfeeefbeb27047622322081673cbe6b27983ce3165e86eca027d54214e662,2,eng_vn_zero_cond_002,zc_002,1,0.5278,,0.4113,,0.4928,correct,1.0,"Câu diễn tả một sự thật hiển nhiên (zero conditional), được chỉ ra bởi trạng từ 'always'. Cấu trúc này yêu cầu động từ trong cả hai mệnh đề đều ở thì hiện tại đơn, do đó 'is' là lựa chọn duy nhất đúng.",correct,1.0,"Stem thể hiện quy luật chung (zero conditional) với 'always', nên thì hiện tại đơn 'is' là phù hợp rõ ràng; các option khác về quá khứ, tương lai, hoàn thành không phù hợp với ngữ cảnh này."
race50_mcq_hehe1,cot,Zero Conditional,mcq,0,7b3cfeeefbeb27047622322081673cbe6b27983ce3165e86eca027d54214e662,3,eng_vn_zero_cond_003,zc_003,1,0.4459,,0.4334,,0.4421,correct,1.0,"Câu diễn tả một sự thật chung (zero conditional), mệnh đề chính ""they can see and hear"" dùng thì hiện tại đơn, do đó mệnh đề ""When"" cũng phải dùng thì hiện tại đơn. Lựa chọn 'a' (""are"") là dạng hiện tại đơn phù hợp duy nhất.",correct,1.0,"Stem mô tả sự thật khoa học (zero conditional) về chó sơ sinh, đòi hỏi thì hiện tại đơn. Option 'a' (are) phù hợp rõ ràng, các option khác dùng thì quá khứ/tương lai/hoàn thành không phù hợp với sự thật chung."
race50_mcq_hehe1,cot,Zero Conditional,mcq,0,7b3cfeeefbeb27047622322081673cbe6b27983ce3165e86eca027d54214e662,4,eng_vn_zero_cond_004,zc_004,1,0.4693,,0.2369,,0.3996,correct,1.0,"Mệnh đề chính ""it usually becomes..."" sử dụng thì hiện tại đơn để diễn tả một sự thật chung, điều này yêu cầu mệnh đề ""if"" cũng phải ở thì hiện tại đơn để tạo thành câu điều kiện loại 0. Do đó, ""treat"" là lựa chọn duy nhất phù hợp về mặt ngữ pháp.",correct,1.0,"Stem thể hiện câu điều kiện loại 0 (mệnh đề chính có 'usually becomes') nên mệnh đề if cần động từ hiện tại đơn. Option a 'treat' phù hợp rõ ràng, các option khác sai thì với cấu trúc này."
race50_mcq_hehe1,cot,Zero Conditional,mcq,0,7b3cfeeefbeb27047622322081673cbe6b27983ce3165e86eca027d54214e662,5,eng_vn_zero_cond_005,zc_005,1,0.5355,,0.2308,,0.4441,correct,1.0,"Mệnh đề 'When' ở thì hiện tại đơn ('is frightened') diễn tả một sự thật chung, một quy luật tự nhiên (câu điều kiện loại 0), do đó mệnh đề chính cũng cần chia ở thì hiện tại đơn. 'lowers' là dạng đúng cho chủ ngữ ngôi thứ ba số ít 'it'.",correct,1.0,"Stem mô tả một sự thật chung (zero conditional) với 'when' chỉ thói quen, nên động từ ở thì hiện tại đơn là phù hợp nhất; option a 'lowers' là lựa chọn rõ ràng, trong khi các option khác dùng thì quá khứ hoặc tương lai không phù hợp với ngữ cảnh này."
