run_id,config,topic,type,seed,source_text_sha,idx,qid_gold,qid_pred,structural_valid,question_sim,ans_sim,distractor_diversity,ans_score,item_score,judge_verdict,judge_score,judge_why,judge2_verdict,judge2_score,judge2_why
race50_mcq_hehe1,cot,Used to,mcq,0,fb3096a1ec4dd8555999ebc276f19a356d3b08de0223a332556127eec9922921,1,used-to-1,used_to_001,1,0.4633,,0.1099,,0.3573,correct,1.0,"Cụm từ chỉ thời gian trong quá khứ 'Five years ago' yêu cầu một cấu trúc diễn tả thói quen đã chấm dứt, tức là 'used to + động từ nguyên thể'. Chỉ có phương án (a) 'used to wait' phù hợp với cấu trúc này.",correct,1.0,"Stem có 'Five years ago' chỉ quá khứ và mô tả thói quen trong quá khứ, nên chỉ có option a 'used to wait' (đã từng chờ) phù hợp ngữ pháp và nghĩa; các option khác diễn đạt thói quen hiện tại hoặc cấu trúc sai."
race50_mcq_hehe1,cot,Used to,mcq,0,fb3096a1ec4dd8555999ebc276f19a356d3b08de0223a332556127eec9922921,2,used-to-2,used_to_002,1,0.5724,,0.3055,,0.4923,correct,1.0,"Mệnh đề chỉ một trạng thái trong quá khứ không còn đúng ở hiện tại ('Before 2002'), do đó cấu trúc 'used to + động từ nguyên thể' (a) là phù hợp nhất. 'Would' (d) thường không dùng cho động từ chỉ trạng thái như 'need', và 'were used to needing' (b) mang nghĩa 'quen với việc gì đó', khác với ý của câu.",correct,1.0,"Stem chỉ thói quen trong quá khứ (trước 2002) với 'because countries had different currencies'. Option a 'used to need' diễn tả thói quen quá khứ phù hợp, trong khi b sai vì 'were used to' nghĩa 'quen với', c sai cấu trúc 'used to + V-ing', và d 'would need' không phù hợp vì thiếu ngữ cảnh thói quen lặp lại rõ ràng."
race50_mcq_hehe1,cot,Used to,mcq,0,fb3096a1ec4dd8555999ebc276f19a356d3b08de0223a332556127eec9922921,3,used-to-3,used_to_003,1,0.4068,,0.1363,,0.3257,correct,1.0,"Câu sử dụng mốc thời gian trong quá khứ 'five years ago' để chỉ một trạng thái không còn đúng ở hiện tại, đòi hỏi cấu trúc 'used to + V-inf'. Lựa chọn (a) 'didn't use to be' là dạng phủ định chính xác của cấu trúc này, trong khi các lựa chọn khác sai ngữ pháp hoặc sai về nghĩa (cấu trúc 'be used to being' có nghĩa là 'quen với').",correct,1.0,"Stem có cụm 'just five years ago' chỉ quá khứ và so sánh với hiện tại, đồng thời cần cấu trúc 'used to' để diễn tả thói quen/quá khứ. Option a 'didn't use to be' đúng ngữ pháp (used to + verb nguyên thể), trong khi các option khác sai: b và d dùng 'used to being' (sau 'to' phải là V-inf), c sai cấu trúc 'use to being'."
race50_mcq_hehe1,cot,Used to,mcq,0,fb3096a1ec4dd8555999ebc276f19a356d3b08de0223a332556127eec9922921,4,used-to-4,used_to_004,1,0.4119,,0.3655,,0.398,correct,1.0,"Stem yêu cầu một cấu trúc diễn tả một trạng thái trong quá khứ không còn đúng ở hiện tại. ""Used to have"" (a) diễn tả chính xác điều này. Các phương án khác không phù hợp: ""were used to having"" (b) mang nghĩa ""quen với việc gì"", ""would have"" (d) thường dùng cho hành động lặp lại chứ không phải trạng thái, và ""used to having"" (c) sai ngữ pháp.",correct,1.0,"Stem chỉ thói quen trong quá khứ (trước khi có Euro) và cấu trúc 'used to + verb' (a) là phù hợp rõ ràng; các lựa chọn khác sai ngữ pháp (b, c dùng 'to having', d thiếu 'used to' cho thói quen quá khứ)."
race50_mcq_hehe1,cot,Used to,mcq,0,fb3096a1ec4dd8555999ebc276f19a356d3b08de0223a332556127eec9922921,5,used-to-5,used_to_005,1,0.4521,,0.1614,,0.3649,correct,1.0,"Stem ""In the past..."" yêu cầu một cấu trúc diễn tả một thói quen hoặc tình trạng trong quá khứ không còn đúng ở hiện tại. Chỉ có option (a) ""used to have"" tạo thành cấu trúc đúng ""used to have to deal with..."", phù hợp về cả ngữ pháp (used to + bare infinitive) và ngữ nghĩa với bối cảnh quá khứ.",correct,1.0,"Stem có 'In the past, before the EU's unification' chỉ thời gian quá khứ, và 'used to have' (a) diễn tả thói quen trong quá khứ đã chấm dứt, phù hợp với ngữ cảnh. Các lựa chọn khác (b, c, d) đều liên quan đến 'be/get used to + V-ing' (quen với việc gì ở hiện tại) hoặc sai cấu trúc, không khớp với dấu hiệu thời gian quá khứ trong stem."
race50_mcq_hehe1,minimal,should/ought to,mcq,0,8f72669722169682903e48095e104632f322d7c66f4f13bfafb9a22af3d43463,1,vn_eng_should_01,q1,1,0.6691,,0.4598,,0.6063,ambiguous,0.5,"Câu hỏi yêu cầu trả lời ""Theo văn bản"", nhưng văn bản không được cung cấp. Do đó, không có cơ sở để xác định nghĩa vụ của người sử dụng lao động là gì, và bất kỳ phương án nào (should, ought not to, don't have to, aren't able to) đều có thể đúng tùy thuộc vào nội dung của văn bản đó.",ambiguous,0.5,"Stem yêu cầu dựa vào văn bản nhưng không cung cấp nội dung văn bản, nên không thể xác định ràng buộc ngữ nghĩa để phân biệt giữa 'should' (b) và 'ought not to' (a) - cả hai đều hợp lý về mặt ngữ pháp nhưng trái ngược nghĩa."
race50_mcq_hehe1,minimal,should/ought to,mcq,0,8f72669722169682903e48095e104632f322d7c66f4f13bfafb9a22af3d43463,2,vn_eng_should_02,q2,1,0.6041,,0.3084,,0.5154,correct,1.0,"Động từ 'suggests' trong câu dẫn mang nghĩa đề xuất hoặc đưa ra lời khuyên. Do đó, động từ khuyết thiếu 'ought to' (mang nghĩa 'nên') là lựa chọn phù hợp nhất về mặt ngữ nghĩa để diễn đạt khuyến nghị này.",correct,1.0,"Stem có từ 'suggests' (gợi ý) thể hiện lời khuyên hoặc khuyến nghị, phù hợp với 'ought to' (nên) thể hiện nghĩa vụ đạo đức. Các option khác ('must not', 'cannot', 'will not') đều mang nghĩa phủ định hoặc cấm đoán, không phù hợp với ngữ cảnh gợi ý."
race50_mcq_hehe1,minimal,should/ought to,mcq,0,8f72669722169682903e48095e104632f322d7c66f4f13bfafb9a22af3d43463,3,vn_eng_should_03,q3,1,0.57,,0.4234,,0.526,correct,1.0,"Mệnh đề chỉ mục đích 'To provide a comfortable life for senior citizens' đòi hỏi một động từ khiếm khuyết diễn tả sự khuyên bảo hoặc nghĩa vụ. Lựa chọn (c) 'ought to' thể hiện chính xác ý nghĩa này, trong khi các lựa chọn khác mang nghĩa phủ định hoặc không cần thiết, mâu thuẫn với mục đích được nêu.",correct,1.0,"Stem có cụm 'to provide a comfortable life' thể hiện mục đích tích cực, nên chỉ option 'ought to' (nên) phù hợp với ngữ cảnh khuyến nghị hành động cần thiết; các option còn lại mang nghĩa phủ định hoặc cấm đoán không phù hợp."
race50_mcq_hehe1,minimal,should/ought to,mcq,0,8f72669722169682903e48095e104632f322d7c66f4f13bfafb9a22af3d43463,4,vn_eng_should_04,q4,1,0.9077,,0.3763,,0.7483,correct,1.0,"Stem đặt ra một câu hỏi về nghĩa vụ hoặc trách nhiệm đạo đức ('who _____ be responsible'). Lựa chọn (c) 'should' là động từ khuyết thiếu duy nhất thể hiện chính xác ý nghĩa này, trong khi các lựa chọn khác diễn tả sự cấm đoán ('mustn't'), lời khuyên tiêu cực ('shouldn't') hoặc sự thiếu khả năng ('isn't able to'), không phù hợp với ngữ cảnh.",correct,1.0,"Stem chỉ ra một vấn đề nghiêm trọng cho xã hội, hàm ý cần tìm giải pháp hoặc trách nhiệm, do đó 'should' (nên) phù hợp để diễn đạt nghĩa khuyến nghị hoặc bổn phận; các option khác ('mustn't', 'shouldn't', 'isn't able to') đều mang nghĩa phủ định hoặc không có khả năng, không phù hợp với ngữ cảnh xác định trách nhiệm."
race50_mcq_hehe1,minimal,should/ought to,mcq,0,8f72669722169682903e48095e104632f322d7c66f4f13bfafb9a22af3d43463,5,vn_eng_should_05,q5,1,0.5609,,0.4199,,0.5186,correct,1.0,"Stem câu tạo ra một sự tương phản giữa một nghĩa vụ/lời khuyên (""take responsibility"") và một thực tế hạn chế (""but... not always viable""). Chỉ có ""ought to"" (a) thể hiện đúng nghĩa vụ hoặc lời khuyên mạnh mẽ này, phù hợp với cấu trúc tương phản của câu.",correct,1.0,"Stem có 'but notes it's not always viable' cho thấy đây là nghĩa vụ đạo đức (ought to) chứ không phải bắt buộc (must) hay khả năng (able to). Option a 'ought to' phù hợp với ngữ cảnh này, trong khi các option khác không khớp với ý 'take responsibility'."
race50_mcq_hehe1,cot,should/ought to,mcq,0,8f72669722169682903e48095e104632f322d7c66f4f13bfafb9a22af3d43463,1,vn_eng_should_01,mcq_should_001,1,0.6691,,0.4442,,0.6016,ambiguous,0.5,"Stem yêu cầu xác định mức độ nghĩa vụ (""must"", ""have to"", ""should"") dựa trên một văn bản không được cung cấp. Không có văn bản tham chiếu, không thể xác định được liệu trách nhiệm của người sử dụng lao động là một nghĩa vụ bắt buộc (must/have to) hay một lời khuyên/nghĩa vụ đạo đức (should).",ambiguous,0.5,"Stem không cung cấp văn bản gốc để xác định mức độ bắt buộc (nghĩa vụ pháp lý 'must/have to' hay khuyến nghị đạo đức 'should'), nên không thể loại trừ các option a, b, c dựa trên ràng buộc ngữ cảnh."
race50_mcq_hehe1,cot,should/ought to,mcq,0,8f72669722169682903e48095e104632f322d7c66f4f13bfafb9a22af3d43463,2,vn_eng_should_02,mcq_should_002,1,0.6938,,0.3241,,0.5829,ambiguous,0.5,"Stem yêu cầu một động từ khiếm khuyết để diễn tả sự cần thiết hoặc khuyến nghị. Cả ""must"" (a), ""ought to"" (b), và ""have to"" (d) đều phù hợp về mặt ngữ pháp và diễn đạt nghĩa vụ hoặc sự cần thiết. Mặc dù ""ought to"" (b) có thể là lựa chọn phù hợp nhất về sắc thái (nghĩa vụ đạo đức), không có đủ thông tin trong câu để loại trừ hoàn toàn ""must"" và ""have to"" vốn cũng diễn tả sự bắt buộc mạnh mẽ một cách hợp lý.",ambiguous,0.5,"Stem không cung cấp đủ ngữ cảnh để phân biệt rõ ràng giữa các phương án b (ought to), a (must), c (are required to) và d (have to) vì tất cả đều có thể diễn đạt nghĩa bắt buộc/cần thiết trong ngữ cảnh này mà không có tín hiệu ngữ pháp hay ngữ nghĩa nào để loại trừ."
race50_mcq_hehe1,cot,should/ought to,mcq,0,8f72669722169682903e48095e104632f322d7c66f4f13bfafb9a22af3d43463,3,vn_eng_should_03,mcq_should_003,1,0.7403,,0.5426,,0.681,correct,1.0,"Mệnh đề 'Although it may not be fair for everyone' cho thấy hành động tiết kiệm là một lời khuyên hoặc khuyến nghị, không phải là một nghĩa vụ tuyệt đối. Do đó, 'should' (b) là động từ tình thái phù hợp nhất để diễn tả sắc thái này.",correct,1.0,"Stem có 'Although it may not be fair for everyone' (mang tính khuyến nghị hơn là bắt buộc) và 'mentions that' (trích dẫn quan điểm từ văn bản) phù hợp với 'should' (nên) hơn 'must' (phải), 'are able to' (có khả năng) hay 'will' (sẽ)."
race50_mcq_hehe1,cot,should/ought to,mcq,0,8f72669722169682903e48095e104632f322d7c66f4f13bfafb9a22af3d43463,4,vn_eng_should_04,mcq_should_004,1,0.6451,,0.4233,,0.5786,ambiguous,0.5,"Stem ""Given the government's financial limitations..."" tạo ra một bối cảnh mà hành động được đề xuất có thể được hiểu là một lời khuyên (should), một sự bắt buộc mạnh mẽ (must), hoặc một sự cần thiết do hoàn cảnh bên ngoài (has to). Không có đủ thông tin trong câu để loại trừ dứt khoát các phương án a, b, và c vì cả ba đều diễn đạt các sắc thái nghĩa hợp lý trong ngữ cảnh này.",ambiguous,0.5,"Stem chỉ ra tình huống 'financial limitations' gợi ý lời khuyên/nghĩa vụ, nhưng không có tín hiệu ngữ pháp rõ ràng để phân biệt 'must', 'should', 'has to' (đều có thể chấp nhận ở mức độ nghĩa vụ khác nhau). 'Is able to' không phù hợp về nghĩa, nhưng ba option còn lại đều có thể hợp lý mà không có bằng chứng loại trừ cụ thể."
race50_mcq_hehe1,cot,should/ought to,mcq,0,8f72669722169682903e48095e104632f322d7c66f4f13bfafb9a22af3d43463,5,vn_eng_should_05,mcq_should_005,1,0.5719,,0.4218,,0.5269,ambiguous,0.5,"Stem yêu cầu một động từ khuyết thiếu để diễn tả sự cần thiết. Cả 'must', 'ought to', và 'has to' đều diễn đạt sự cần thiết hoặc khuyến nghị mạnh mẽ và phù hợp về mặt ngữ pháp. Không có đủ thông tin trong câu để phân biệt sắc thái ý nghĩa và chọn ra một đáp án duy nhất đúng.",incorrect,0.0,"Stem không có ràng buộc ngữ pháp hay ngữ nghĩa rõ ràng để phân biệt 'ought to' với 'must' hoặc 'has to'; cả ba đều có thể diễn đạt sự cần thiết một cách hợp lý, không có bằng chứng loại trừ."
race50_mcq_hehe1,minimal,Second Conditional,mcq,0,0c408d0b6715a77ad3a7aa490fd6ca9a11cc2bd65aad29d93940d12c3093d967,1,eng-vn-sec-cond-01,q1,1,0.6133,,0.0894,,0.4562,ambiguous,0.5,"Stem không cung cấp đủ ngữ cảnh để phân biệt giữa một tình huống có khả năng xảy ra (Câu điều kiện loại 1) và một tình huống giả định (Câu điều kiện loại 2). Do đó, cả hai phương án 'a' (had / would buy) và 'b' (have / will buy) đều tạo thành câu đúng ngữ pháp và hợp lý.",correct,1.0,"Stem thể hiện câu điều kiện loại 2 với tình huống giả định không có thật ở hiện tại, đòi hỏi cấu trúc 'If + past simple, would + V'. Chỉ option a ('had / would buy') tuân thủ đúng quy tắc này; các option còn lại kết hợp thì sai và bị loại."
race50_mcq_hehe1,minimal,Second Conditional,mcq,0,0c408d0b6715a77ad3a7aa490fd6ca9a11cc2bd65aad29d93940d12c3093d967,2,eng-vn-sec-cond-02,q2,1,0.4894,,0.1515,,0.3881,ambiguous,0.5,"Stem không cung cấp ngữ cảnh để xác định đây là tình huống thực tế có thể xảy ra (Câu điều kiện loại 1) hay tình huống giả định (Câu điều kiện loại 2). Do đó, cả hai phương án a (studied / would pass) và b (studies / will pass) đều tạo thành các câu đúng ngữ pháp và hợp lý.",correct,1.0,"Stem thể hiện câu điều kiện loại 2 với tình huống giả định trong quá khứ, nên cần 'studied' (quá khứ đơn) và 'would pass' (would + V_inf). Chỉ option a đáp ứng đúng; các option khác sai vì phối thì không phù hợp."
race50_mcq_hehe1,minimal,Second Conditional,mcq,0,0c408d0b6715a77ad3a7aa490fd6ca9a11cc2bd65aad29d93940d12c3093d967,3,eng-vn-sec-cond-03,q3,1,0.5208,,0.2006,,0.4247,correct,1.0,"Stem ""If I _____ you"" thiết lập một tình huống giả định để đưa ra lời khuyên, yêu cầu cấu trúc câu điều kiện loại 2. Lựa chọn 'a' (were / would accept) tuân thủ đúng quy tắc ngữ pháp với động từ ""were"" ở dạng giả định cách (subjunctive mood) và ""would accept"" ở mệnh đề chính.",correct,1.0,"Câu điều kiện loại 2 yêu cầu 'were' cho tất cả chủ ngữ trong mệnh đề if và 'would + V' trong mệnh đề chính, nên chỉ có option a đáp ứng đầy đủ cả hai điều kiện này."
race50_mcq_hehe1,minimal,Second Conditional,mcq,0,0c408d0b6715a77ad3a7aa490fd6ca9a11cc2bd65aad29d93940d12c3093d967,4,eng-vn-sec-cond-04,q4,1,0.4887,,0.1361,,0.3829,ambiguous,0.5,"Stem không cung cấp ngữ cảnh để xác định đây là một tình huống giả định (câu điều kiện loại 2) hay một khả năng có thật (câu điều kiện loại 1). Do đó, cả phương án (a) ""had / could"" (loại 2) và (b) ""have / can"" (loại 1) đều tạo thành câu đúng ngữ pháp và hợp lý.",correct,1.0,"Stem thể hiện câu điều kiện loại 2 với tình huống giả định không có thật ở hiện tại, đòi hỏi 'had' trong mệnh đề if và 'could' trong mệnh đề chính; chỉ option a thỏa mãn, các option khác vi phạm quy tắc phối hợp thì."
race50_mcq_hehe1,minimal,Second Conditional,mcq,0,0c408d0b6715a77ad3a7aa490fd6ca9a11cc2bd65aad29d93940d12c3093d967,5,eng-vn-sec-cond-05,q5,1,0.4638,,0.1599,,0.3726,correct,1.0,"Câu hỏi đưa ra một tình huống giả định, không có thật ở hiện tại (""if you _____ a ghost?""), đòi hỏi cấu trúc câu điều kiện loại 2. Lựa chọn (a) ""would / do / saw"" tuân thủ đúng công thức của câu điều kiện loại 2 (If + S + V2/ed, S + would + V-inf), trong khi các lựa chọn khác sai ngữ pháp hoặc không phù hợp với ngữ cảnh giả định này.",correct,1.0,"Stem yêu cầu cấu trúc câu điều kiện loại 2 (giả định không có thật ở hiện tại), chỉ có option A 'would/do/saw' tuân thủ đúng quy tắc: would + V_inf + V2/Ved. Các option khác sai: B và D dùng 'will' không phù hợp, C dùng 'see' thay vì 'saw' ở mệnh đề if."
race50_mcq_hehe1,cot,Second Conditional,mcq,0,0c408d0b6715a77ad3a7aa490fd6ca9a11cc2bd65aad29d93940d12c3093d967,1,eng-vn-sec-cond-01,sc_001,1,0.8091,,0.3274,,0.6646,correct,1.0,"Mệnh đề chính 'I would donate...' sử dụng cấu trúc 'would + động từ nguyên mẫu', xác định đây là câu điều kiện loại 2. Cấu trúc này yêu cầu động từ trong mệnh đề 'if' phải ở thì quá khứ đơn, do đó 'had' (a) là lựa chọn duy nhất đúng.",correct,1.0,"Stem thể hiện câu điều kiện loại 2 với mệnh đề chính 'would donate', do đó mệnh đề 'if' cần động từ ở quá khứ đơn 'had'. Option a là phù hợp rõ ràng, các option còn lại không đúng cấu trúc."
race50_mcq_hehe1,cot,Second Conditional,mcq,0,0c408d0b6715a77ad3a7aa490fd6ca9a11cc2bd65aad29d93940d12c3093d967,2,eng-vn-sec-cond-02,sc_002,1,0.7213,,0.3581,,0.6123,correct,1.0,"Stem là câu điều kiện loại 2, diễn tả một giả định trái với hiện tại, yêu cầu động từ trong mệnh đề 'if' ở dạng quá khứ giả định (subjunctive mood). 'Were' (b) là dạng chuẩn và đúng ngữ pháp cho tất cả các chủ ngữ trong cấu trúc này.",correct,1.0,"Stem thể hiện câu điều kiện loại 2 (giả định không có thật ở hiện tại) với 'would be able to', do đó cần động từ ở dạng quá khứ giả định. Option 'b' (were) là hình thức đúng cho chủ ngữ 'she' trong câu điều kiện loại 2, trong khi các option khác ('was', 'is', 'had been') không phù hợp với cấu trúc này."
race50_mcq_hehe1,cot,Second Conditional,mcq,0,0c408d0b6715a77ad3a7aa490fd6ca9a11cc2bd65aad29d93940d12c3093d967,3,eng-vn-sec-cond-03,sc_003,1,0.6309,,0.2909,,0.5289,correct,1.0,"Mệnh đề 'if' sử dụng thì quá khứ đơn ('adopted'), cho thấy đây là câu điều kiện loại 2. Do đó, mệnh đề chính phải có cấu trúc 'would + động từ nguyên mẫu', khiến cho 'would have' là lựa chọn duy nhất đúng về mặt ngữ pháp.",correct,1.0,"Stem chứa mệnh đề 'if' với động từ 'adopted' ở thì quá khứ đơn trong ngữ cảnh giả định, phù hợp với cấu trúc câu điều kiện loại 2; chỉ option 'a' (would have) kết hợp đúng với điều kiện này, trong khi các option khác vi phạm quy tắc ngữ pháp về sự phối hợp thì."
race50_mcq_hehe1,cot,Second Conditional,mcq,0,0c408d0b6715a77ad3a7aa490fd6ca9a11cc2bd65aad29d93940d12c3093d967,4,eng-vn-sec-cond-04,sc_004,1,0.6794,,0.2495,,0.5504,correct,1.0,"Mệnh đề chính ""they wouldn't treat"" cho thấy đây là câu điều kiện loại 2, diễn tả một giả định trái với hiện tại. Do đó, mệnh đề ""If"" phải sử dụng thì quá khứ đơn, và ""knew"" là lựa chọn duy nhất phù hợp về mặt ngữ pháp.",correct,1.0,"Câu điều kiện loại 2 yêu cầu mệnh đề 'if' dùng thì quá khứ đơn. Option 'a' (knew) là dạng quá khứ đơn của 'know', phù hợp với cấu trúc ngữ pháp. Các option khác không đúng: 'b' (know) là hiện tại đơn, 'c' (had known) là quá khứ hoàn thành (cho loại 3), 'd' (would know) dùng trong mệnh đề chính."
race50_mcq_hehe1,cot,Second Conditional,mcq,0,0c408d0b6715a77ad3a7aa490fd6ca9a11cc2bd65aad29d93940d12c3093d967,5,eng-vn-sec-cond-05,sc_005,1,0.6221,,0.1577,,0.4828,correct,1.0,"Mệnh đề 'If' sử dụng thì quá khứ đơn ('didn't have'), cho thấy đây là câu điều kiện loại 2. Theo cấu trúc này, mệnh đề chính phải ở dạng 'would + động từ nguyên thể', vì vậy 'would suffer' là lựa chọn duy nhất đúng về mặt ngữ pháp.",correct,1.0,"Stem chứa cấu trúc điều kiện loại 2 với 'If we didn't have' (quá khứ đơn), đòi hỏi mệnh đề chính dùng 'would + verb'. Option a 'would suffer' phù hợp hoàn toàn, các option khác (will suffer, suffer, suffered) không đúng cấu trúc ngữ pháp."
race50_mcq_hehe1,minimal,Second Conditional,mcq,0,9faf64c0d34936faa6e1d7ed3da8b1cb3589f653d142c9b294992b6180aeccaa,1,eng_vn_sec_cond_01,q1,1,0.4555,,0.3271,,0.4169,correct,1.0,"Câu điều kiện trong stem diễn tả một tình huống giả định, không có thật ở hiện tại, đòi hỏi cấu trúc câu điều kiện loại 2. Lựa chọn 'a' (were / would) tuân thủ đúng cấu trúc ngữ pháp chuẩn của câu điều kiện loại 2 (If + S + V-ed/were, S + would + V-inf).",correct,1.0,"Stem yêu cầu câu điều kiện loại 2 (giả định không có thật ở hiện tại), chỉ có option 'a' (were / would) tuân thủ đúng cấu trúc ngữ pháp với 'were' cho chủ ngữ 'I' và 'would' cho mệnh đề chính."
race50_mcq_hehe1,minimal,Second Conditional,mcq,0,9faf64c0d34936faa6e1d7ed3da8b1cb3589f653d142c9b294992b6180aeccaa,2,eng_vn_sec_cond_02,q2,1,0.4767,,0.2483,,0.4082,correct,1.0,"Câu điều kiện diễn tả một tình huống giả định ở hiện tại (unreal present conditional), yêu cầu cấu trúc câu điều kiện loại 2: If + S + V(past subjunctive), S + would + V(bare). Lựa chọn 'b' (were / would) tuân thủ đúng cấu trúc này, sử dụng dạng giả định cách 'were' là chuẩn mực và trang trọng.",correct,1.0,"Stem yêu cầu câu điều kiện loại 2 (giả định không có thật ở hiện tại), nên động từ 'were' (cho chủ ngữ 'she') và 'would' là cấu trúc chuẩn. Option b đáp ứng đúng; các option khác dùng 'was' (không chuẩn), 'is/will' (loại 1), hoặc 'were/will' (kết hợp sai) đều vi phạm quy tắc."
race50_mcq_hehe1,minimal,Second Conditional,mcq,0,9faf64c0d34936faa6e1d7ed3da8b1cb3589f653d142c9b294992b6180aeccaa,3,eng_vn_sec_cond_03,q3,1,0.4642,,0.2241,,0.3922,ambiguous,0.5,"Stem không cung cấp đủ ngữ cảnh để phân biệt giữa một tình huống có thể xảy ra trong tương lai (câu điều kiện loại 1) và một tình huống giả định trái với hiện tại (câu điều kiện loại 2). Do đó, cả hai phương án ""had / would"" (loại 2) và ""has / will"" (loại 1) đều đúng về mặt ngữ pháp và hợp lý về mặt ngữ nghĩa.",correct,1.0,"Stem thể hiện câu điều kiện loại 2 với tình huống giả định không có thật ở hiện tại, do đó chỉ có option A (had / would) tuân thủ đúng cấu trúc ngữ pháp: mệnh đề 'if' dùng thì quá khứ đơn, mệnh đề chính dùng 'would + V-inf'."
race50_mcq_hehe1,minimal,Second Conditional,mcq,0,9faf64c0d34936faa6e1d7ed3da8b1cb3589f653d142c9b294992b6180aeccaa,4,eng_vn_sec_cond_04,q4,1,0.5355,,0.3766,,0.4878,correct,1.0,"Câu điều kiện trong stem diễn tả một tình huống giả định ở hiện tại, đòi hỏi cấu trúc câu điều kiện loại 2 (If + S + V2/Ved, S + would + V-inf). Lựa chọn (b) ""would / were"" tuân thủ chính xác cấu trúc này, sử dụng dạng giả định cách (subjunctive mood) ""were"" là chuẩn mực cho chủ ngữ ""I"".",correct,1.0,"Câu điều kiện loại 2 diễn tả tình huống giả định không có thật ở hiện tại, đòi hỏi 'would + V' ở mệnh đề chính và 'were' (không phải 'was') cho chủ ngữ 'I' trong mệnh đề if. Option b đáp ứng đúng cả hai yêu cầu này."
