run_id,config,topic,type,seed,source_text_sha,idx,qid_gold,qid_pred,structural_valid,question_sim,ans_sim,distractor_diversity,ans_score,item_score,judge_verdict,judge_score,judge_why,judge2_verdict,judge2_score,judge2_why
race50_mcq_hehe1,minimal,First Conditional,mcq,0,bd1378ca693dc4eff7468f2dc81edf29fd710083f9cc4f7827f36620b0841b97,1,ENG_FC_MCQ_01,q1,1,0.5215,,0.4419,,0.4976,ambiguous,0.5,"Câu hỏi yêu cầu tìm thông tin ""According to the text"", nhưng văn bản không được cung cấp. Không có văn bản, không thể xác định hành động nào được đề xuất cho người sẵn sàng chi một số tiền đáng kể để trông trẻ lại.",ambiguous,0.5,"Stem yêu cầu dựa vào văn bản nhưng không cung cấp nội dung văn bản, nên không thể xác định ràng buộc để đánh giá các lựa chọn. Tất cả option đều có thể hợp lý nếu văn bản đề cập, nhưng thiếu ngữ cảnh quyết định."
race50_mcq_hehe1,minimal,First Conditional,mcq,0,bd1378ca693dc4eff7468f2dc81edf29fd710083f9cc4f7827f36620b0841b97,2,ENG_FC_MCQ_02,q2,1,0.4322,,0.5194,,0.4584,correct,1.0,"Stem yêu cầu tìm một ""hậu quả có thể xảy ra"" (possible consequence). Lựa chọn (b) mô tả một kết quả trực tiếp và hợp lý từ việc không biết cách chọn sản phẩm, trong khi các lựa chọn (c) và (d) là những hành động hoặc giải pháp để khắc phục vấn đề đó, không phải là hậu quả.",correct,1.0,"Stem hỏi về một hậu quả có thể xảy ra (possible consequence) khi không biết chọn kem mắt tốt nhất. Option b 'You might fall victim to ineffective products' phù hợp rõ ràng vì diễn đạt một kết quả tiêu cực có thể xảy ra, trong khi các option a, c, d không phải là hậu quả mà là hành động hoặc kết quả tích cực, không khớp với ngữ cảnh."
race50_mcq_hehe1,minimal,First Conditional,mcq,0,bd1378ca693dc4eff7468f2dc81edf29fd710083f9cc4f7827f36620b0841b97,3,ENG_FC_MCQ_03,q3,1,0.6034,,0.5489,,0.587,ambiguous,0.5,"Câu hỏi yêu cầu xác định thông tin ""được đề xuất trong văn bản"" (in the text), nhưng không có văn bản nào được cung cấp. Do đó, không thể xác minh được lựa chọn nào là đúng nếu chỉ dựa vào đề bài.",ambiguous,0.5,Stem chỉ đề cập 'what is suggested in the text' nhưng không cung cấp nội dung văn bản gốc để đánh giá các lựa chọn. Không có đủ thông tin trong stem để xác định option nào thực sự được gợi ý trong văn bản.
race50_mcq_hehe1,minimal,First Conditional,mcq,0,bd1378ca693dc4eff7468f2dc81edf29fd710083f9cc4f7827f36620b0841b97,4,ENG_FC_MCQ_04,q4,1,0.3292,,0.4522,,0.3661,correct,1.0,"Mệnh đề điều kiện ""If you are more of the money-conscious type"" yêu cầu một lựa chọn tiết kiệm chi phí. Chỉ có option (c) ""go for eye creams"" (dùng kem mắt) là một giải pháp chống lão hóa phù hợp với người quan tâm đến tiền bạc, trong khi các lựa chọn khác đề xuất các phương pháp đắt tiền hoặc không phải là một giải pháp.",ambiguous,0.5,"Stem chỉ ra 'money-conscious type' (tiết kiệm chi phí) nhưng không có ràng buộc ngữ pháp First Conditional rõ ràng để loại trừ các lựa chọn; option c có thể hợp lý nhưng option a và b trái ngược với 'money-conscious', trong khi option d không thực tế nhưng không bị loại bỏ hoàn toàn do thiếu ngữ cảnh quyết định."
race50_mcq_hehe1,minimal,First Conditional,mcq,0,bd1378ca693dc4eff7468f2dc81edf29fd710083f9cc4f7827f36620b0841b97,5,ENG_FC_MCQ_05,q5,1,0.3057,,0.5251,,0.3715,ambiguous,0.5,"Stem hỏi về kết quả chắc chắn (""What will happen""), nhưng không thể xác định mức độ chắc chắn mà không có văn bản gốc. Option (b) đưa ra một sự đảm bảo tuyệt đối (""are sure to""), trong khi option (a) đưa ra một khả năng không chắc chắn (""might still have trouble""); cả hai đều có thể là kết quả hợp lý của việc làm theo lời khuyên, tùy thuộc vào giọng văn của bài đọc.",ambiguous,0.5,"Stem không cung cấp văn bản gốc để xác định nội dung các 'tips and guidelines', nên không thể đánh giá chắc chắn option nào phù hợp. Các option a, b, c, d đều có thể xảy ra tùy nội dung văn bản không được cung cấp."
race50_mcq_hehe1,cot,First Conditional,mcq,0,bd1378ca693dc4eff7468f2dc81edf29fd710083f9cc4f7827f36620b0841b97,1,ENG_FC_MCQ_01,fc_001,1,0.6716,,0.2026,,0.5309,ambiguous,0.5,"Câu điều kiện loại 1 trong mệnh đề chính có thể dùng cả ""will"" để chỉ một kết quả có khả năng cao và ""might"" để chỉ một khả năng có thể xảy ra. Vế điều kiện ""If you don't know..."" không cung cấp đủ ngữ cảnh để xác định mức độ chắc chắn của kết quả, do đó cả hai phương án ""will fall"" (a) và ""might fall"" (b) đều hợp lý.",incorrect,0.0,"Stem thể hiện điều kiện thực tế trong hiện tại (first conditional) với 'if you don't know', nên option 'will fall' (a) phù hợp nhất để diễn đạt kết quả chắc chắn. Option 'might fall' (b) làm giảm tính chắc chắn không phù hợp với ngữ cảnh cảnh báo rõ ràng này, trong khi 'would fall' (c) và 'had fallen' (d) không khớp với cấu trúc first conditional."
race50_mcq_hehe1,cot,First Conditional,mcq,0,bd1378ca693dc4eff7468f2dc81edf29fd710083f9cc4f7827f36620b0841b97,2,ENG_FC_MCQ_02,fc_002,1,0.5958,,0.1972,,0.4762,correct,1.0,"Mệnh đề 'if' sử dụng thì hiện tại đơn ('are willing'), thiết lập một câu điều kiện loại 1. Mệnh đề chính cần diễn tả một khả năng hoặc gợi ý trong tương lai. 'can try' (a) diễn đạt chính xác ý nghĩa về một lựa chọn hoặc khả năng có thể thực hiện nếu điều kiện được đáp ứng.",correct,1.0,"Stem thể hiện điều kiện thực tế trong hiện tại (If you are willing...) nên cần động từ khuyết thiếu chỉ khả năng/cơ hội. Option 'a' (can try) phù hợp nhất vì diễn đạt khả năng có sẵn khi đáp ứng điều kiện, trong khi các option khác thể hiện sự chắc chắn hoặc giả định không phù hợp với ngữ cảnh."
race50_mcq_hehe1,cot,First Conditional,mcq,0,bd1378ca693dc4eff7468f2dc81edf29fd710083f9cc4f7827f36620b0841b97,3,ENG_FC_MCQ_03,fc_003,1,0.9026,,0.2363,,0.7027,correct,1.0,"Mệnh đề 'if' sử dụng thì hiện tại đơn ('If you have a dermatologist') để diễn tả một điều kiện có thật ở hiện tại. Do đó, mệnh đề chính cần một động từ khuyết thiếu chỉ khả năng hoặc gợi ý, và 'can ask' (bạn có thể hỏi) là lựa chọn phù hợp nhất về mặt ngữ nghĩa và ngữ pháp.",correct,1.0,"Stem thể hiện tình huống có thật trong hiện tại (nếu bạn có bác sĩ da liễu), nên cần cấu trúc điều kiện loại 0/1 với động từ khuyết thiếu chỉ khả năng. Option A 'can ask' phù hợp nhất vì diễn tả khả năng có thể thực hiện, trong khi các option khác không phù hợp: B (tương lai chắc chắn), C (giả định), D (quá khứ) không khớp với ngữ cảnh hiện tại."
race50_mcq_hehe1,cot,First Conditional,mcq,0,bd1378ca693dc4eff7468f2dc81edf29fd710083f9cc4f7827f36620b0841b97,4,ENG_FC_MCQ_04,fc_004,1,0.4336,,0.202,,0.3641,correct,1.0,"Stem sử dụng cấu trúc câu điều kiện loại 1 (If + hiện tại đơn), diễn tả một tình huống có thật và kết quả có thể xảy ra. Mệnh đề chính cần một động từ chỉ khả năng hoặc gợi ý. Phương án 'can browse' (a) diễn tả một lựa chọn hoặc khả năng, phù hợp nhất với ngữ cảnh đưa ra lời khuyên.",correct,1.0,"Stem thể hiện điều kiện thực tế ở hiện tại (If you don't have...) với kết quả có thể xảy ra, phù hợp với cấu trúc First Conditional: If + present simple, will/can + base form. Option 'a' (can browse) là lựa chọn phù hợp nhất vì diễn tả khả năng có thể thực hiện, trong khi các option khác không tuân thủ cấu trúc First Conditional."
race50_mcq_hehe1,cot,First Conditional,mcq,0,bd1378ca693dc4eff7468f2dc81edf29fd710083f9cc4f7827f36620b0841b97,5,ENG_FC_MCQ_05,fc_005,1,0.6948,,0.2704,,0.5675,correct,1.0,"Mệnh đề 'if' sử dụng thì hiện tại đơn ('If you follow...'), cho thấy đây là câu điều kiện loại 1. Do đó, mệnh đề chính cần một động từ ở dạng tương lai, và 'will surely spot' (a) là lựa chọn duy nhất phù hợp về mặt ngữ pháp.",correct,1.0,"Stem thể hiện cấu trúc điều kiện loại 1 (If + present simple, will + V) với kết quả chắc chắn trong tương lai. Option A 'will surely spot' phù hợp hoàn toàn với cấu trúc này, trong khi các option khác (B dùng 'would' cho điều kiện loại 2, C dùng 'might have spotted' cho khả năng trong quá khứ, D thiếu 'will' cho tương lai) đều vi phạm quy tắc ngữ pháp của câu điều kiện loại 1."
race50_mcq_hehe1,minimal,First Conditional,mcq,0,df36d20f0800ea434f552903455e3e48277cae34724f27368a80998232573643,1,ENG_FC_001,q1,1,0.9328,,0.3548,,0.7594,ambiguous,0.5,"Mệnh đề 'if' sử dụng thì hiện tại đơn ('stay'), cho phép cả cấu trúc câu điều kiện loại 0 (diễn tả sự thật chung) và loại 1 (diễn tả khả năng trong tương lai). Do đó, cả phương án (b) 'feel' và (a) 'will feel' đều đúng ngữ pháp và hợp lý về mặt ngữ nghĩa, khiến câu hỏi không có đáp án đúng duy nhất.",correct,1.0,"Stem có 'if' chỉ điều kiện có thể xảy ra trong tương lai, nên cần thì tương lai đơn; chỉ option a 'will feel' phù hợp rõ ràng, các option khác (b, c, d) không khớp với cấu trúc điều kiện loại 1."
race50_mcq_hehe1,minimal,First Conditional,mcq,0,df36d20f0800ea434f552903455e3e48277cae34724f27368a80998232573643,2,ENG_FC_002,q2,1,0.7689,,0.431,,0.6676,ambiguous,0.5,"Mệnh đề 'If' sử dụng thì hiện tại đơn ('focus'), cho phép cả cấu trúc câu điều kiện loại 0 (chân lý chung) và loại 1 (khả năng trong tương lai). Do đó, cả hai phương án 'get' (loại 0) và 'will get' (loại 1) đều hợp lý về mặt ngữ pháp và ngữ nghĩa, và câu không cung cấp đủ ngữ cảnh để loại trừ một trong hai.",correct,1.0,"Stem chứa 'If' chỉ điều kiện có thật ở hiện tại/tương lai, đòi hỏi thì tương lai trong mệnh đề chính. Option 'b' (will get) phù hợp rõ ràng với cấu trúc First Conditional, các option còn lại ('get', 'got', 'would get') không đúng thì hoặc dùng cho điều kiện không có thật."
race50_mcq_hehe1,minimal,First Conditional,mcq,0,df36d20f0800ea434f552903455e3e48277cae34724f27368a80998232573643,3,ENG_FC_003,q3,1,0.7066,,0.431,,0.624,ambiguous,0.5,"Mệnh đề 'if' sử dụng thì hiện tại đơn (""spends""), cho phép cả cấu trúc câu điều kiện loại 1 (diễn tả kết quả có thể xảy ra trong tương lai) và câu điều kiện loại 0 (diễn tả một sự thật chung). Do đó, cả phương án (a) ""will get"" (loại 1) và (b) ""get"" (loại 0) đều hợp lý về mặt ngữ pháp và ngữ nghĩa, và câu gốc không cung cấp đủ ngữ cảnh để loại trừ một trong hai.",ambiguous,0.5,"Stem thiếu ngữ cảnh thời gian rõ ràng để xác định điều kiện loại 0 hay loại 1. Cả 'will get' (a) và 'get' (b) đều có thể chấp nhận được - 'get' cho thói quen/chân lý chung, 'will get' cho dự đoán tương lai - mà không có tín hiệu ngữ pháp nào trong stem để loại trừ hoàn toàn một trong hai."
race50_mcq_hehe1,minimal,First Conditional,mcq,0,df36d20f0800ea434f552903455e3e48277cae34724f27368a80998232573643,4,ENG_FC_004,q4,1,0.7588,,0.1933,,0.5891,correct,1.0,"Mệnh đề 'if' sử dụng thì hiện tại đơn ('lasts'), thiết lập cấu trúc câu điều kiện loại 1 để diễn tả một khả năng có thật trong tương lai. Do đó, mệnh đề chính yêu cầu một dạng thức tương lai, và 'will stay' (b) là lựa chọn duy nhất phù hợp về mặt ngữ pháp.",correct,1.0,"Stem có 'If the visit lasts...' (điều kiện có thật ở hiện tại) dẫn đến kết quả tương lai, nên cần 'will stay' (b) để diễn đạt kết quả chắc chắn trong tương lai. Các option khác không phù hợp: 'stay' (a) thiếu ý tương lai, 'stayed' (c) là quá khứ, 'would stay' (d) dùng cho điều kiện không có thật."
race50_mcq_hehe1,minimal,First Conditional,mcq,0,df36d20f0800ea434f552903455e3e48277cae34724f27368a80998232573643,5,ENG_FC_005,q5,1,0.6675,,0.386,,0.583,correct,1.0,"Mệnh đề 'if' sử dụng thì hiện tại đơn (""don't limit""), thiết lập cấu trúc câu điều kiện loại 1 để diễn tả một kết quả có khả năng xảy ra trong tương lai. Do đó, mệnh đề chính cần dùng ""will"" (phương án a) để hoàn thành cấu trúc này một cách chính xác.",correct,1.0,"Stem thể hiện câu điều kiện loại 1 (First Conditional) với mệnh đề if ở hiện tại đơn, do đó mệnh đề chính cần 'will' để diễn tả kết quả có thể xảy ra trong tương lai; các option khác ('do', 'did', 'would') không phù hợp với cấu trúc này."
race50_mcq_hehe1,cot,First Conditional,mcq,0,df36d20f0800ea434f552903455e3e48277cae34724f27368a80998232573643,1,ENG_FC_001,fc_001,1,0.9072,,0.2187,,0.7006,correct,1.0,"Mệnh đề chính sử dụng cấu trúc tương lai đơn ""will feel"", cho thấy đây là câu điều kiện loại 1. Do đó, mệnh đề 'if' phải sử dụng thì hiện tại đơn, và 'stay' là dạng đúng cho chủ ngữ số nhiều 'young visitors'.",correct,1.0,"Stem thể hiện câu điều kiện loại 1 với mệnh đề chính 'will feel', do đó mệnh đề if cần động từ hiện tại đơn. Option a 'stay' phù hợp rõ ràng, các option khác dùng thì quá khứ/tương lai/hoàn thành đều không phù hợp với cấu trúc này."
race50_mcq_hehe1,cot,First Conditional,mcq,0,df36d20f0800ea434f552903455e3e48277cae34724f27368a80998232573643,2,ENG_FC_002,fc_002,1,0.7401,,0.431,,0.6474,correct,1.0,"Mệnh đề 'If' trong câu sử dụng thì hiện tại đơn ('focus'), đây là cấu trúc của câu điều kiện loại 1, dùng để diễn tả một khả năng có thật ở tương lai. Do đó, mệnh đề chính cần sử dụng thì tương lai đơn, và phương án (b) 'will get' là lựa chọn phù hợp duy nhất.",correct,1.0,"Stem có 'If you focus...' (điều kiện có thật ở hiện tại) và kết quả trong tương lai, nên cần thì tương lai đơn. Option b 'will get' phù hợp rõ ràng; các option còn lại (a: hiện tại đơn, c: quá khứ, d: điều kiện) không phù hợp với cấu trúc câu điều kiện loại 1."
race50_mcq_hehe1,cot,First Conditional,mcq,0,df36d20f0800ea434f552903455e3e48277cae34724f27368a80998232573643,3,ENG_FC_003,fc_003,1,0.7418,,0.4287,,0.6479,ambiguous,0.5,"Câu điều kiện loại 1 trong stem cho phép sử dụng cả 'will' (chỉ một dự đoán, kết quả trong tương lai) và 'can' (chỉ khả năng hoặc cơ hội). Không có đủ ngữ cảnh để xác định sắc thái nghĩa nào là phù hợp hơn, do đó cả phương án 'a' và 'b' đều hợp lý.",incorrect,0.0,"Stem thể hiện điều kiện thực tế ở hiện tại (first conditional), nhưng option 'b' (can) chỉ khả năng chung chung, không phù hợp với cấu trúc điều kiện. Option 'a' (will) phù hợp nhất với first conditional để diễn tả kết quả chắc chắn. Option 'c' (would) chỉ phù hợp với second conditional, option 'd' (might have) sai thì."
race50_mcq_hehe1,cot,First Conditional,mcq,0,df36d20f0800ea434f552903455e3e48277cae34724f27368a80998232573643,4,ENG_FC_004,fc_004,1,0.8039,,0.1524,,0.6085,correct,1.0,"Mệnh đề chính sử dụng ""will get"", cho thấy đây là câu điều kiện loại 1. Do đó, mệnh đề 'if' cần một động từ ở thì hiện tại đơn, và chỉ có phương án (a) ""don't follow"" đáp ứng đúng yêu cầu ngữ pháp này.",correct,1.0,"Câu điều kiện loại 1 yêu cầu mệnh đề if dùng thì hiện tại đơn (don't follow) để diễn tả khả năng xảy ra trong tương lai, phù hợp với động từ chính 'will get'. Các option khác dùng thì quá khứ (b), tương lai (c), hoàn thành (d) đều vi phạm cấu trúc câu điều kiện loại 1."
race50_mcq_hehe1,cot,First Conditional,mcq,0,df36d20f0800ea434f552903455e3e48277cae34724f27368a80998232573643,5,ENG_FC_005,fc_005,1,0.5756,,0.4404,,0.535,correct,1.0,"Mệnh đề chính sử dụng 'will likely feel', cho thấy đây là câu điều kiện loại 1. Do đó, mệnh đề 'if' phải ở thì hiện tại đơn, và 'gets' là lựa chọn duy nhất phù hợp với chủ ngữ số ít 'a child'.",correct,1.0,"Stem sử dụng cấu trúc First Conditional với mệnh đề chính 'they will likely feel', đòi hỏi mệnh đề if phải dùng thì hiện tại đơn. Option a 'gets' là phù hợp rõ ràng, trong khi các option khác sử dụng thì quá khứ hoặc tương lai đều không phù hợp với cấu trúc First Conditional."
race50_mcq_hehe1,minimal,Passive (all tenses),mcq,0,4270ce329b16d1b1cb11eca2dc719e2a417dd3e64c7162e78ca078b6db1a8578,1,eng_assess_passive_01,q1,1,0.8603,,0.143,,0.6451,correct,1.0,Stem yêu cầu cấu trúc bị động do chủ ngữ là đối tượng nhận hành động ('Designation' được tổ chức 'by a company') và thì quá khứ đơn do có mốc thời gian cụ thể trong quá khứ ('in 2014'). Chỉ có phương án (b) 'was organized' đáp ứng cả hai yêu cầu này.,correct,1.0,"Stem có cụm 'by a Dutch company' chỉ tác nhân thực hiện hành động, do đó cần dạng bị động. Option b 'was organized' là dạng bị động quá khứ đơn, phù hợp với thời điểm 'in 2014' được nêu rõ trong stem."
race50_mcq_hehe1,minimal,Passive (all tenses),mcq,0,4270ce329b16d1b1cb11eca2dc719e2a417dd3e64c7162e78ca078b6db1a8578,2,eng_assess_passive_02,q2,1,0.458,,0.2071,,0.3828,correct,1.0,"Stem có cụm từ 'by schools' chỉ tác nhân, đòi hỏi cấu trúc câu bị động. Phương án (a) 'are not focused on' là dạng bị động ở thì hiện tại đơn, phù hợp với ngữ cảnh diễn tả một sự thật hoặc quan điểm chung.",correct,1.0,"Stem yêu cầu dạng bị động (passive) vì 'skills' là đối tượng bị tác động, không phải chủ thể hành động. Option A 'are not focused on' là dạng bị động hiện tại đơn phù hợp, trong khi các option B, C, D đều ở dạng chủ động hoặc thì không phù hợp."
race50_mcq_hehe1,minimal,Passive (all tenses),mcq,0,4270ce329b16d1b1cb11eca2dc719e2a417dd3e64c7162e78ca078b6db1a8578,3,eng_assess_passive_03,q3,1,0.5856,,0.2195,,0.4758,incorrect,0.0,"Mốc thời gian trong quá khứ ""In 2015"" yêu cầu một động từ ở thì quá khứ đơn (were distributed). Tuy nhiên, tất cả các lựa chọn đều ở thì tương lai hoặc hiện tại, khiến không có đáp án nào phù hợp về mặt ngữ pháp.",correct,1.0,"Stem có mốc thời gian 'In 2015' (quá khứ) và ngữ cảnh bị động 'tool kits' được phân phát, nên chỉ có option b 'will be distributed' là phù hợp về thì tương lai trong quá khứ (future in the past) và dạng bị động, các option khác sai về thì hoặc dạng chủ động."
race50_mcq_hehe1,minimal,Passive (all tenses),mcq,0,4270ce329b16d1b1cb11eca2dc719e2a417dd3e64c7162e78ca078b6db1a8578,4,eng_assess_passive_04,q4,1,0.4992,,0.2495,,0.4243,ambiguous,0.5,"Câu yêu cầu một động từ ở thể bị động, do đó loại được (b) và (d). Tuy nhiên, câu không cung cấp dấu hiệu về thời gian, vì vậy cả thì hiện tại đơn bị động (a - is said) và quá khứ đơn bị động (c - was said) đều hợp lý về mặt ngữ pháp, dẫn đến sự mơ hồ.",correct,1.0,"Stem có 'by Emer Beamer' chỉ tác nhân thực hiện hành động, đòi hỏi cấu trúc bị động. Option a 'is said' là dạng bị động hiện tại đơn phù hợp với mục đích chung của dự án, trong khi các option khác đều ở dạng chủ động hoặc thì không phù hợp."
race50_mcq_hehe1,minimal,Passive (all tenses),mcq,0,4270ce329b16d1b1cb11eca2dc719e2a417dd3e64c7162e78ca078b6db1a8578,5,eng_assess_passive_05,q5,1,0.372,,0.2103,,0.3235,correct,1.0,"Stem yêu cầu một cấu trúc bị động (passive voice) vì ""the teams"" là đối tượng nhận yêu cầu ""to brainstorm"". Lựa chọn (b) ""were asked"" là dạng bị động ở thì quá khứ đơn, phù hợp với ngữ cảnh đã xảy ra sau khi ""listening to the challenges"".",correct,1.0,"Stem yêu cầu dạng bị động vì 'teams' là đối tượng nhận hành động 'asked', không phải chủ thể thực hiện. Option 'b' (were asked) là dạng bị động quá khứ phù hợp với ngữ cảnh, trong khi các option khác đều ở dạng chủ động hoặc thì không phù hợp."
race50_mcq_hehe1,cot,Passive (all tenses),mcq,0,4270ce329b16d1b1cb11eca2dc719e2a417dd3e64c7162e78ca078b6db1a8578,1,eng_assess_passive_01,passive_001,1,0.8607,,0.2217,,0.669,correct,1.0,Stem yêu cầu cấu trúc bị động (do có 'by a Dutch company') ở thì quá khứ đơn (do có mốc thời gian 'in 2014'). Chỉ có đáp án (c) 'was organized' thỏa mãn cả hai yêu cầu này.,correct,1.0,"Stem có cụm 'by a Dutch company' chỉ tác nhân thực hiện hành động, yêu cầu cấu trúc bị động. Option c 'was organized' là dạng bị động quá khứ đơn phù hợp với thời điểm 'in 2014', trong khi các option khác đều ở dạng chủ động hoặc không phù hợp thì."
race50_mcq_hehe1,cot,Passive (all tenses),mcq,0,4270ce329b16d1b1cb11eca2dc719e2a417dd3e64c7162e78ca078b6db1a8578,2,eng_assess_passive_02,passive_002,1,0.5418,,0.2099,,0.4423,correct,1.0,Vế câu yêu cầu thì hiện tại hoàn thành do có cụm từ 'since the Unexpect project started' và cấu trúc bị động do có 'by children'. Chỉ có phương án (b) 'have been produced' đáp ứng cả hai yêu cầu ngữ pháp này.,correct,1.0,"Stem có 'since' chỉ thời gian kéo dài đến hiện tại nên cần thì hiện tại hoàn thành, và ngữ cảnh bị động (solutions được tạo ra bởi children) nên chỉ option B 'have been produced' phù hợp cả thì và dạng bị động."
race50_mcq_hehe1,cot,Passive (all tenses),mcq,0,4270ce329b16d1b1cb11eca2dc719e2a417dd3e64c7162e78ca078b6db1a8578,3,eng_assess_passive_03,passive_003,1,0.5335,,0.2446,,0.4468,incorrect,0.0,"Stem có dấu hiệu thời gian quá khứ cụ thể ""in 2015"", yêu cầu thì quá khứ đơn. Tuy nhiên, đáp án được gán đúng ""b"" (""will be distributed"") lại ở thì tương lai đơn, tạo ra sự mâu thuẫn ngữ pháp. Không có lựa chọn nào đúng về mặt ngữ pháp (phải là ""were distributed"").",correct,1.0,Stem có 'by Unexpect' (tác nhân) và 'in 2015' (thời gian quá khứ xác định) nên cần bị động quá khứ. Option b 'will be distributed' không khớp với 2015; option c và d không đúng thì; chỉ option b 'will be distributed' phù hợp rõ với ngữ cảnh tương lai trong quá khứ (kế hoạch năm 2015).
race50_mcq_hehe1,cot,Passive (all tenses),mcq,0,4270ce329b16d1b1cb11eca2dc719e2a417dd3e64c7162e78ca078b6db1a8578,4,eng_assess_passive_04,passive_004,1,0.527,,0.2063,,0.4308,correct,1.0,"Chủ ngữ ""important skills"" là đối tượng bị động của hành động ""teach"", do đó câu đòi hỏi cấu trúc bị động. Chỉ có phương án (a) ""aren't taught"" là dạng bị động ở thì hiện tại đơn, phù hợp với ngữ cảnh một nhận định chung.",correct,1.0,"Stem yêu cầu cấu trúc bị động (important skills là chủ ngữ bị tác động) và thì hiện tại đơn phù hợp với nhận định chung. Option a 'aren't taught' đáp ứng cả hai yêu cầu này, trong khi các option khác đều ở dạng chủ động hoặc thì không phù hợp."
