run_id,config,topic,type,seed,source_text_sha,idx,qid_gold,qid_pred,structural_valid,question_sim,ans_sim,distractor_diversity,ans_score,item_score,judge_verdict,judge_score,judge_why,judge2_verdict,judge2_score,judge2_why
20251029_135707,minimal,Past Simple,mcq,0,37e7c751d0427d113ad35f910005e4b1b542da01442b71b88960a3b9d0e83fb4,1,ps_001,q1,1,0.3869,,0.6876,,0.4772,ambiguous,0.5,"Stem hỏi 'Ai chịu trách nhiệm' nhưng không cung cấp ngữ cảnh để phân biệt giữa hai phương án hợp lệ là (a) một nhóm nhà nghiên cứu và (b) một nhà nghiên cứu cụ thể. Cả hai đều là câu trả lời khả thi cho câu hỏi 'Who', do đó không thể xác định đáp án duy nhất chỉ dựa vào câu hỏi.",error,0.0,Client.__init__() got an unexpected keyword argument 'proxies'
20251029_135707,minimal,Past Simple,mcq,0,37e7c751d0427d113ad35f910005e4b1b542da01442b71b88960a3b9d0e83fb4,2,ps_002,q2,1,0.6608,,0.271,,0.5438,correct,1.0,"Stem yêu cầu hành động xảy ra ""ngay sau khi"" (immediately after) có được chuỗi DNA. Lựa chọn (a) ""so sánh chúng với DNA của voi hiện đại"" mô tả một hành động trực tiếp và hợp lý ngay sau đó. Lựa chọn (b) mô tả mục tiêu hoặc kết quả của việc so sánh, không phải là hành động tức thời, trong khi (c) và (d) là kết luận cuối cùng hoặc một nghiên cứu không liên quan.",error,0.0,Client.__init__() got an unexpected keyword argument 'proxies'
20251029_135707,minimal,Past Simple,mcq,0,37e7c751d0427d113ad35f910005e4b1b542da01442b71b88960a3b9d0e83fb4,3,ps_003,q3,1,0.6366,,0.2019,,0.5062,correct,1.0,"Câu hỏi yêu cầu tìm một phát hiện về ""voi rừng và voi savan hiện đại"". Lựa chọn (b) trả lời trực tiếp cho yêu cầu này bằng cách nêu rõ mối quan hệ giữa chúng (""rất khác biệt với nhau""), trong khi các lựa chọn khác hoặc không liên quan (c) hoặc đưa ra kết luận trái ngược (a, d).",error,0.0,Client.__init__() got an unexpected keyword argument 'proxies'
20251029_135707,minimal,Past Simple,mcq,0,37e7c751d0427d113ad35f910005e4b1b542da01442b71b88960a3b9d0e83fb4,4,ps_004,q4,1,0.2575,,0.5297,,0.3392,ambiguous,0.5,"Câu hỏi yêu cầu kiến thức nền chuyên biệt về cổ sinh vật học mà không cung cấp bất kỳ thông tin nào trong stem. Không có kiến thức bên ngoài, người học không thể xác định được câu trả lời đúng giữa các phương án a, b, và c chỉ dựa vào cấu trúc câu hỏi.",error,0.0,Client.__init__() got an unexpected keyword argument 'proxies'
20251029_135707,minimal,Past Simple,mcq,0,37e7c751d0427d113ad35f910005e4b1b542da01442b71b88960a3b9d0e83fb4,5,ps_005,q5,1,0.622,,0.357,,0.5425,ambiguous,0.5,"Câu hỏi yêu cầu xác định phản ứng của các nhà khoa học, nhưng bản thân câu hỏi không cung cấp bất kỳ thông tin hay ngữ cảnh nào để có thể suy luận ra phản ứng đó. Bất kỳ phương án nào (bối rối, kinh ngạc, thờ ơ, hoài nghi) đều có thể hợp lý tùy thuộc vào bối cảnh không được cung cấp.",error,0.0,Client.__init__() got an unexpected keyword argument 'proxies'
20251029_135707,minimal,Past Simple,mcq,0,37e7c751d0427d113ad35f910005e4b1b542da01442b71b88960a3b9d0e83fb4,6,ps_006,q6,1,0.3423,,0.3965,,0.3586,ambiguous,0.5,"Stem hỏi về một niềm tin trong quá khứ ('previously') nhưng không cung cấp bất kỳ văn bản hay ngữ cảnh nào. Cả hai phương án (a) 'hai loài riêng biệt' và (b) 'hai quần thể của cùng một loài' đều là những giả thuyết khoa học hợp lý, và không có thông tin trong câu hỏi để xác định đâu là niềm tin được nhắc đến.",error,0.0,Client.__init__() got an unexpected keyword argument 'proxies'
20251029_135707,minimal,Past Simple,mcq,0,37e7c751d0427d113ad35f910005e4b1b542da01442b71b88960a3b9d0e83fb4,7,ps_007,q7,1,0.6882,,0.3868,,0.5978,ambiguous,0.5,"Câu hỏi yêu cầu xác định đâu là điểm khác biệt ""quan trọng"" (significant) theo các nhà tự nhiên học trước khi có phân tích DNA. Dựa vào câu hỏi, có thể loại trừ phương án (a) ""Their genetic makeup"". Tuy nhiên, các phương án còn lại là môi trường sống (b), kích thước (c), và chế độ ăn (d) đều là những khác biệt có thể quan sát được. Câu hỏi không cung cấp đủ thông tin để xác định yếu tố nào được coi là ""quan trọng"" nhất, khiến nhiều phương án đều có thể hợp lý.",error,0.0,Client.__init__() got an unexpected keyword argument 'proxies'
20251029_135707,minimal,Past Simple,mcq,0,37e7c751d0427d113ad35f910005e4b1b542da01442b71b88960a3b9d0e83fb4,8,ps_008,q8,1,0.4559,,0.5312,,0.4785,correct,1.0,"Câu hỏi yêu cầu tìm ""bằng chứng cuối cùng"" (ultimate proof). Phân tích DNA (option c) là phương pháp khoa học quyết định và dứt khoát nhất để xác định các loài riêng biệt, phù hợp chặt chẽ với yêu cầu của câu hỏi hơn so với các quan sát về kích thước, môi trường sống hoặc ý kiến.",error,0.0,Client.__init__() got an unexpected keyword argument 'proxies'
20251029_135707,minimal,Past Simple,mcq,0,37e7c751d0427d113ad35f910005e4b1b542da01442b71b88960a3b9d0e83fb4,9,ps_009,q9,1,0.5383,,0.4594,,0.5146,ambiguous,0.5,"Câu hỏi yêu cầu trích xuất thông tin cụ thể (""What did Alfred Roca say..."") từ một văn bản không được cung cấp. Không có văn bản nguồn, không thể xác minh được lựa chọn nào là câu trả lời chính xác và loại trừ các lựa chọn hợp lý khác.",error,0.0,Client.__init__() got an unexpected keyword argument 'proxies'
20251029_135707,minimal,Past Simple,mcq,0,37e7c751d0427d113ad35f910005e4b1b542da01442b71b88960a3b9d0e83fb4,10,ps_010,q10,1,0.4446,,0.4224,,0.438,ambiguous,0.5,"Câu hỏi yêu cầu xác định một phương pháp cụ thể đã được các nhà khoa học sử dụng, nhưng lại không cung cấp bất kỳ văn bản hay ngữ cảnh nào. Do đó, không thể xác định phương pháp nào trong các lựa chọn đã thực sự được dùng mà không dựa vào kiến thức bên ngoài.",error,0.0,Client.__init__() got an unexpected keyword argument 'proxies'
20251029_135707,cot,Past Simple,mcq,0,37e7c751d0427d113ad35f910005e4b1b542da01442b71b88960a3b9d0e83fb4,1,ps_001,ps_mcq_001,1,0.7579,,0.1522,,0.5762,correct,1.0,"Stem yêu cầu một động từ ở thể bị động (do có 'by researchers') và thì quá khứ đơn (do có 'last year'). Chỉ có phương án 'a' (""was made"") đáp ứng cả hai yêu cầu này.",error,0.0,Client.__init__() got an unexpected keyword argument 'proxies'
20251029_135707,cot,Past Simple,mcq,0,37e7c751d0427d113ad35f910005e4b1b542da01442b71b88960a3b9d0e83fb4,2,ps_002,ps_mcq_002,1,0.833,,0.2803,,0.6672,correct,1.0,"Mệnh đề chính sử dụng thì quá khứ đơn ""compared"", xác định bối cảnh trong quá khứ. Liên từ ""Once"" giới thiệu một hành động đã hoàn thành trước đó, do đó thì quá khứ đơn ""obtained"" là lựa chọn phù hợp nhất để diễn tả chuỗi sự kiện này.",error,0.0,Client.__init__() got an unexpected keyword argument 'proxies'
20251029_135707,cot,Past Simple,mcq,0,37e7c751d0427d113ad35f910005e4b1b542da01442b71b88960a3b9d0e83fb4,3,ps_003,ps_mcq_003,1,0.7794,,0.2738,,0.6277,ambiguous,0.5,"Cụm từ chỉ thời gian 'in their recent study' trong câu có thể đi kèm với cả thì Quá khứ đơn (a: 'found') để chỉ một hành động đã kết thúc trong quá khứ, và thì Hiện tại hoàn thành (c: 'have found') để nhấn mạnh một phát hiện gần đây có kết quả liên quan đến hiện tại. Vì cả hai phương án đều hợp lý về mặt ngữ pháp và ngữ nghĩa, câu hỏi không có đáp án đúng duy nhất.",error,0.0,Client.__init__() got an unexpected keyword argument 'proxies'
20251029_135707,cot,Past Simple,mcq,0,37e7c751d0427d113ad35f910005e4b1b542da01442b71b88960a3b9d0e83fb4,4,ps_004,ps_mcq_004,1,0.6633,,0.2801,,0.5483,correct,1.0,"Cụm từ chỉ thời gian 'several million years ago' xác định một sự kiện đã xảy ra và kết thúc trong quá khứ, do đó yêu cầu động từ phải ở thì quá khứ đơn ('used').",error,0.0,Client.__init__() got an unexpected keyword argument 'proxies'
20251029_135707,cot,Past Simple,mcq,0,37e7c751d0427d113ad35f910005e4b1b542da01442b71b88960a3b9d0e83fb4,5,ps_005,ps_mcq_005,1,0.9467,,0.2364,,0.7336,correct,1.0,"Mệnh đề trạng ngữ chỉ thời gian ""around the time of the divergence of Asian elephants and woolly mammoths"" chỉ một thời điểm cụ thể đã kết thúc trong quá khứ, do đó yêu cầu sử dụng thì quá khứ đơn ""took place"".",error,0.0,Client.__init__() got an unexpected keyword argument 'proxies'
20251029_135707,cot,Past Simple,mcq,0,37e7c751d0427d113ad35f910005e4b1b542da01442b71b88960a3b9d0e83fb4,6,ps_006,ps_mcq_006,1,0.5477,,0.2718,,0.4649,correct,1.0,"Mệnh đề chứa trạng từ chỉ thời gian quá khứ cụ thể (""last month"") yêu cầu động từ phải được chia ở thì quá khứ đơn. Chỉ có phương án (a) ""amazed"" đáp ứng đúng yêu cầu ngữ pháp này.",error,0.0,Client.__init__() got an unexpected keyword argument 'proxies'
20251029_135707,cot,Past Simple,mcq,0,37e7c751d0427d113ad35f910005e4b1b542da01442b71b88960a3b9d0e83fb4,7,ps_007,ps_mcq_007,1,0.8057,,0.2385,,0.6356,correct,1.0,"Trạng từ ""Previously"" chỉ một thời điểm đã kết thúc trong quá khứ, đòi hỏi việc sử dụng thì quá khứ đơn. Do đó, phương án (a) ""believed"" là lựa chọn duy nhất phù hợp về mặt ngữ pháp và ngữ cảnh.",error,0.0,Client.__init__() got an unexpected keyword argument 'proxies'
20251029_135707,cot,Past Simple,mcq,0,37e7c751d0427d113ad35f910005e4b1b542da01442b71b88960a3b9d0e83fb4,8,ps_008,ps_mcq_008,1,0.5377,,0.3637,,0.4855,ambiguous,0.5,"Mệnh đề trạng ngữ ""Before the recent study"" thiết lập một điểm thời gian trong quá khứ. Cả thì Quá khứ đơn (a - were) và Quá khứ hoàn thành (d - had been) đều có thể được sử dụng để mô tả một hành động hoặc trạng thái xảy ra trước điểm thời gian đó, và không có tín hiệu nào trong câu để loại trừ một trong hai phương án.",error,0.0,Client.__init__() got an unexpected keyword argument 'proxies'
20251029_135707,cot,Past Simple,mcq,0,37e7c751d0427d113ad35f910005e4b1b542da01442b71b88960a3b9d0e83fb4,9,ps_009,ps_mcq_009,1,0.6593,,0.2551,,0.538,correct,1.0,"Trạng từ chỉ thời gian xác định trong quá khứ 'last week' yêu cầu động từ phải được chia ở thì quá khứ đơn. Do đó, 'said' (a) là lựa chọn duy nhất phù hợp về mặt ngữ pháp.",error,0.0,Client.__init__() got an unexpected keyword argument 'proxies'
20251029_135707,cot,Past Simple,mcq,0,37e7c751d0427d113ad35f910005e4b1b542da01442b71b88960a3b9d0e83fb4,10,ps_010,ps_mcq_010,1,0.6259,,0.2091,,0.5008,correct,1.0,Mệnh đề 'before comparing them' thiết lập một chuỗi hành động đã hoàn tất trong quá khứ. Thì Quá khứ đơn (Past Simple) 'obtained' là lựa chọn phù hợp nhất để diễn tả hành động xảy ra và kết thúc trước một hành động khác trong quá khứ.,error,0.0,Client.__init__() got an unexpected keyword argument 'proxies'
20251029_135707,minimal,Past Simple,mcq,0,b1b73ab6340e783eea1618d193ea16cf42d6c9197ee3d88b913d6db6371e66f1,1,past_simple_001,1,1,0.8618,,0.3613,,0.7116,correct,1.0,"Câu mô tả một hành động đơn lẻ, đã hoàn thành trong quá khứ. Thì quá khứ đơn (saw) là lựa chọn phù hợp nhất cho ngữ cảnh tường thuật này, trong khi các thì khác không diễn tả đúng ý nghĩa của một sự việc đã xảy ra.",error,0.0,Client.__init__() got an unexpected keyword argument 'proxies'
20251029_135707,minimal,Past Simple,mcq,0,b1b73ab6340e783eea1618d193ea16cf42d6c9197ee3d88b913d6db6371e66f1,2,past_simple_002,2,1,0.834,,0.1727,,0.6356,correct,1.0,Câu mô tả một chuỗi hai hành động đã hoàn tất trong quá khứ. Thì Quá khứ đơn (Past Simple) trong phương án (b) 'stopped / got' là lựa chọn phù hợp nhất để diễn tả các hành động xảy ra nối tiếp nhau.,error,0.0,Client.__init__() got an unexpected keyword argument 'proxies'
20251029_135707,minimal,Past Simple,mcq,0,b1b73ab6340e783eea1618d193ea16cf42d6c9197ee3d88b913d6db6371e66f1,3,past_simple_003,3,1,0.6936,,0.4507,,0.6208,ambiguous,0.5,"Stem không cung cấp bất kỳ dấu hiệu thời gian nào (ví dụ: 'yesterday', 'now') để xác định thì của động từ. Cả hai phương án 'is' (thì hiện tại) và 'was' (thì quá khứ) đều tạo ra câu hoàn toàn hợp lý về mặt ngữ pháp và ngữ nghĩa, do đó không có cơ sở để chọn một đáp án duy nhất.",error,0.0,Client.__init__() got an unexpected keyword argument 'proxies'
20251029_135707,minimal,Past Simple,mcq,0,b1b73ab6340e783eea1618d193ea16cf42d6c9197ee3d88b913d6db6371e66f1,4,past_simple_004,4,1,0.4959,,0.1822,,0.4018,ambiguous,0.5,"Stem không cung cấp bất kỳ dấu hiệu thời gian nào, do đó cả hai phương án (a) ""knows / feels"" (thì hiện tại đơn) và (b) ""knew / felt"" (thì quá khứ đơn) đều tạo thành câu đúng ngữ pháp và hợp lý về mặt logic. Không có cơ sở trong câu để loại trừ một trong hai phương án này.",error,0.0,Client.__init__() got an unexpected keyword argument 'proxies'
20251029_135707,minimal,Past Simple,mcq,0,b1b73ab6340e783eea1618d193ea16cf42d6c9197ee3d88b913d6db6371e66f1,5,past_simple_005,5,1,0.5423,,0.2551,,0.4561,ambiguous,0.5,"Stem không cung cấp dấu hiệu thời gian để xác định thì của động từ tường thuật. Do đó, cả hai phương án 'said' (quá khứ đơn) và 'says' (hiện tại đơn) đều có thể tạo thành câu đúng ngữ pháp và hợp lý về mặt ngữ nghĩa.",error,0.0,Client.__init__() got an unexpected keyword argument 'proxies'
20251029_135707,minimal,Past Simple,mcq,0,b1b73ab6340e783eea1618d193ea16cf42d6c9197ee3d88b913d6db6371e66f1,6,past_simple_006,6,1,0.5529,,0.3297,,0.4859,ambiguous,0.5,"Câu gốc không chứa bất kỳ trạng từ chỉ thời gian hay ngữ cảnh nào để xác định thì của động từ. Do đó, các phương án cho thì hiện tại (a: has), quá khứ (b: had) và tương lai (d: will have) đều tạo thành câu đúng ngữ pháp và hợp lý, không có cơ sở để chọn một đáp án duy nhất.",error,0.0,Client.__init__() got an unexpected keyword argument 'proxies'
20251029_135707,minimal,Past Simple,mcq,0,b1b73ab6340e783eea1618d193ea16cf42d6c9197ee3d88b913d6db6371e66f1,7,past_simple_007,7,1,0.5285,,0.1566,,0.417,correct,1.0,"Câu mô tả một chuỗi hành động đã hoàn tất trong quá khứ, do đó việc sử dụng thì Quá khứ đơn (Past Simple) cho cả hai động từ như trong phương án (b) là hoàn toàn chính xác để diễn tả trình tự sự việc.",error,0.0,Client.__init__() got an unexpected keyword argument 'proxies'
20251029_135707,minimal,Past Simple,mcq,0,b1b73ab6340e783eea1618d193ea16cf42d6c9197ee3d88b913d6db6371e66f1,8,past_simple_008,8,1,0.5948,,0.3228,,0.5132,correct,1.0,"Mệnh đề phụ ""After Joe helped her"" sử dụng thì quá khứ đơn, thiết lập một bối cảnh thời gian rõ ràng trong quá khứ. Do đó, mệnh đề chính cũng phải ở thì quá khứ để diễn tả một chuỗi hành động đã hoàn tất, và chỉ có ""drove"" (b) là phù hợp.",error,0.0,Client.__init__() got an unexpected keyword argument 'proxies'
20251029_135707,minimal,Past Simple,mcq,0,b1b73ab6340e783eea1618d193ea16cf42d6c9197ee3d88b913d6db6371e66f1,9,past_simple_009,9,1,0.5941,,0.2925,,0.5036,ambiguous,0.5,"Câu gốc không chứa bất kỳ trạng từ chỉ thời gian hay ngữ cảnh nào để xác định thì của động từ. Do đó, nhiều phương án như ""went"" (b), ""has gone"" (c), và ""is going"" (d) đều có thể tạo thành một câu đúng về mặt ngữ pháp tùy thuộc vào tình huống không được nêu rõ.",error,0.0,Client.__init__() got an unexpected keyword argument 'proxies'
20251029_135707,minimal,Past Simple,mcq,0,b1b73ab6340e783eea1618d193ea16cf42d6c9197ee3d88b913d6db6371e66f1,10,past_simple_010,10,1,0.7663,,0.3574,,0.6436,correct,1.0,"Mệnh đề phụ ""When the waitress came back"" sử dụng thì quá khứ đơn, thiết lập bối cảnh thời gian trong quá khứ. Do đó, mệnh đề chính cũng cần một động từ ở thì quá khứ đơn để diễn tả một hành động đã xảy ra và hoàn tất tại thời điểm đó, khiến cho (b) ""noticed"" là lựa chọn phù hợp duy nhất.",error,0.0,Client.__init__() got an unexpected keyword argument 'proxies'
20251029_135707,cot,Past Simple,mcq,0,b1b73ab6340e783eea1618d193ea16cf42d6c9197ee3d88b913d6db6371e66f1,1,past_simple_001,ps_001,1,0.9448,,0.3613,,0.7698,correct,1.0,"Cụm từ chỉ thời gian 'One evening' xác định một sự kiện đã xảy ra tại một thời điểm cụ thể trong quá khứ, đòi hỏi phải sử dụng thì quá khứ đơn. Do đó, 'saw' (b) là lựa chọn duy nhất đúng về mặt ngữ pháp.",error,0.0,Client.__init__() got an unexpected keyword argument 'proxies'
20251029_135707,cot,Past Simple,mcq,0,b1b73ab6340e783eea1618d193ea16cf42d6c9197ee3d88b913d6db6371e66f1,2,past_simple_002,ps_002,1,0.7884,,0.1727,,0.6037,correct,1.0,"Câu mô tả một chuỗi hành động đã hoàn tất trong quá khứ, do đó yêu cầu thì quá khứ đơn. Lựa chọn 'b' (stopped / got) là lựa chọn duy nhất sử dụng đúng thì quá khứ đơn cho cả hai hành động nối tiếp nhau.",error,0.0,Client.__init__() got an unexpected keyword argument 'proxies'
20251029_135707,cot,Past Simple,mcq,0,b1b73ab6340e783eea1618d193ea16cf42d6c9197ee3d88b913d6db6371e66f1,3,past_simple_003,ps_003,1,0.6874,,0.3297,,0.5801,correct,1.0,"Mệnh đề phụ 'which was why she was stranded' sử dụng thì quá khứ, do đó động từ trong mệnh đề chính cũng phải ở thì quá khứ để diễn tả nguyên nhân của sự việc. 'had' là lựa chọn duy nhất ở thì quá khứ đơn phù hợp với ngữ cảnh này.",error,0.0,Client.__init__() got an unexpected keyword argument 'proxies'
20251029_135707,cot,Past Simple,mcq,0,b1b73ab6340e783eea1618d193ea16cf42d6c9197ee3d88b913d6db6371e66f1,4,past_simple_004,ps_004,1,0.7116,,0.1529,,0.544,correct,1.0,"Stem có động từ 'crawled' ở thì quá khứ đơn. Liên từ 'and' nối hai hành động song song, yêu cầu động từ thứ hai cũng phải ở thì quá khứ đơn, do đó 'changed' là đáp án duy nhất đúng về mặt ngữ pháp.",error,0.0,Client.__init__() got an unexpected keyword argument 'proxies'
20251029_135707,cot,Past Simple,mcq,0,b1b73ab6340e783eea1618d193ea16cf42d6c9197ee3d88b913d6db6371e66f1,5,past_simple_005,ps_005,1,0.5062,,0.1273,,0.3925,correct,1.0,Câu mô tả một sự việc trong quá khứ. Lựa chọn (b) 'asked / owed' sử dụng thì quá khứ đơn một cách chính xác cho cả hành động (hỏi) và trạng thái (nợ). Lựa chọn (d) 'was asking / was owing' không đúng ngữ pháp vì 'owe' là một động từ trạng thái và thường không được dùng ở dạng tiếp diễn.,error,0.0,Client.__init__() got an unexpected keyword argument 'proxies'
20251029_135707,cot,Past Simple,mcq,0,b1b73ab6340e783eea1618d193ea16cf42d6c9197ee3d88b913d6db6371e66f1,6,past_simple_006,ps_006,1,0.5351,,0.1751,,0.4271,ambiguous,0.5,"Stem không cung cấp bối cảnh thời gian cụ thể. Do đó, cả hai phương án (a) 'tells / wants' (tường thuật ở thì hiện tại) và (b) 'told / wanted' (tường thuật ở thì quá khứ) đều tạo thành câu đúng ngữ pháp và hợp lý, không có cơ sở để loại trừ một trong hai.",error,0.0,Client.__init__() got an unexpected keyword argument 'proxies'
20251029_135707,cot,Past Simple,mcq,0,b1b73ab6340e783eea1618d193ea16cf42d6c9197ee3d88b913d6db6371e66f1,7,past_simple_007,ps_007,1,0.6231,,0.3599,,0.5442,correct,1.0,"Mệnh đề phụ ""After Joe helped her"" sử dụng thì quá khứ đơn, thiết lập một chuỗi hành động đã hoàn tất trong quá khứ. Do đó, mệnh đề chính cũng cần sử dụng thì quá khứ đơn (""drove"") để diễn tả hành động xảy ra tiếp theo.",error,0.0,Client.__init__() got an unexpected keyword argument 'proxies'
20251029_135707,cot,Past Simple,mcq,0,b1b73ab6340e783eea1618d193ea16cf42d6c9197ee3d88b913d6db6371e66f1,8,past_simple_008,ps_008,1,0.6286,,0.2156,,0.5047,correct,1.0,"Stem mô tả một chuỗi hành động đã hoàn thành trong quá khứ, được nối với nhau bằng 'and then'. Thì quá khứ đơn (went / remembered) ở phương án 'b' là lựa chọn chính xác để diễn đạt các sự kiện xảy ra nối tiếp nhau.",error,0.0,Client.__init__() got an unexpected keyword argument 'proxies'
20251029_135707,cot,Past Simple,mcq,0,b1b73ab6340e783eea1618d193ea16cf42d6c9197ee3d88b913d6db6371e66f1,9,past_simple_009,ps_009,1,0.795,,0.3221,,0.6532,correct,1.0,"Mệnh đề ""When the waitress came back"" thiết lập một bối cảnh tường thuật ở thì quá khứ đơn. Do đó, các động từ trong câu chính và mệnh đề phụ cũng cần chia ở thì quá khứ đơn để diễn tả các hành động đã hoàn tất, làm cho phương án 'b' (noticed / helped) là lựa chọn duy nhất phù hợp về mặt ngữ pháp.",error,0.0,Client.__init__() got an unexpected keyword argument 'proxies'
20251029_135707,cot,Past Simple,mcq,0,b1b73ab6340e783eea1618d193ea16cf42d6c9197ee3d88b913d6db6371e66f1,10,past_simple_010,ps_010,1,0.742,,0.2036,,0.5805,correct,1.0,"Cụm từ chỉ thời gian trong quá khứ ""That night"" ở đầu câu yêu cầu sử dụng thì quá khứ đơn. Lựa chọn 'b' (""got / needed"") sử dụng chính xác thì quá khứ đơn để diễn tả hai hành động đã xảy ra và hoàn tất trong quá khứ.",error,0.0,Client.__init__() got an unexpected keyword argument 'proxies'
20251029_135707,minimal,Past Simple,mcq,0,4944d8acfc6dd5bbcd830a8e627fa520fced7bfe7623fb5782a8711ce0aa43ab,1,ps_001,q1,1,0.5614,,0.2084,,0.4555,ambiguous,0.5,"Trạng từ 'recently' có thể được sử dụng với cả thì Quá khứ đơn (Past Simple) và Hiện tại hoàn thành (Present Perfect). Do đó, cả hai phương án 'b' (turned) và 'd' (has turned) đều đúng ngữ pháp và phù hợp về mặt ngữ nghĩa, khiến câu hỏi có nhiều hơn một đáp án đúng.",error,0.0,Client.__init__() got an unexpected keyword argument 'proxies'
20251029_135707,minimal,Past Simple,mcq,0,4944d8acfc6dd5bbcd830a8e627fa520fced7bfe7623fb5782a8711ce0aa43ab,2,ps_002,q2,1,0.5158,,0.2114,,0.4245,correct,1.0,"Cụm từ chỉ thời gian ""A few days ago"" trong câu gốc yêu cầu sử dụng thì quá khứ đơn. Lựa chọn ""b"" (""tried"") là phương án duy nhất chia ở thì quá khứ đơn, do đó là đáp án đúng.",error,0.0,Client.__init__() got an unexpected keyword argument 'proxies'
20251029_135707,minimal,Past Simple,mcq,0,4944d8acfc6dd5bbcd830a8e627fa520fced7bfe7623fb5782a8711ce0aa43ab,3,ps_003,q3,1,0.9321,,0.2269,,0.7205,correct,1.0,"Trạng từ ""once"" trong câu chỉ một hành động đã hoàn tất tại một thời điểm cụ thể trong quá khứ, do đó yêu cầu sử dụng thì quá khứ đơn. Lựa chọn (b) ""cleared"" là thì quá khứ đơn duy nhất phù hợp.",error,0.0,Client.__init__() got an unexpected keyword argument 'proxies'
20251029_135707,minimal,Past Simple,mcq,0,4944d8acfc6dd5bbcd830a8e627fa520fced7bfe7623fb5782a8711ce0aa43ab,4,ps_004,q4,1,0.5695,,0.4507,,0.5339,correct,1.0,"Mệnh đề phụ ""when he said"" chỉ một thời điểm cụ thể trong quá khứ. Do đó, động từ ở mệnh đề chính phải ở thì quá khứ đơn (""was"") để diễn tả một trạng thái (đúng) tại thời điểm đó.",error,0.0,Client.__init__() got an unexpected keyword argument 'proxies'
20251029_135707,minimal,Past Simple,mcq,0,4944d8acfc6dd5bbcd830a8e627fa520fced7bfe7623fb5782a8711ce0aa43ab,5,ps_005,q5,1,0.8962,,0.2681,,0.7077,ambiguous,0.5,"Stem không cung cấp bất kỳ dấu hiệu thời gian nào để xác định thì của động từ. Do đó, cả ba phương án 'isn't' (hiện tại), 'wasn't' (quá khứ), và 'hasn't been' (hiện tại hoàn thành) đều có thể tạo thành câu đúng ngữ pháp và có nghĩa.",error,0.0,Client.__init__() got an unexpected keyword argument 'proxies'
